Comparison	Cell_type	Age	Dataset	pval	padj	ES	NES	leadingEdge
HGG-G34R.V_vs_HGG-H3.3-K27M-pons	MGE Radial Glia 2	Human fetal	Nowakowski et al 2017	2.3872045834328001e-4	4.824456651540483e-4	0.6488969128762166	2.545519791864276	ORC6, RAD51AP1, MCM3, CDK6, VEPH1, RAD18, BRIP1, PCNA, PCNA, WDHD1, KIAA0101, PLK4, TIMELESS, MCM10, CHAF1A, VWA9, MCM9, BRCA2, MCM7, CHEK1, GINS2, MCM5, CDK2, BRCA1, CDK1, MCM4, RBL1, TRIM9, RFC3, HELLS, FEN1, LRR1, CENPU, KNTC1, WDR76, UTP20, DTL, TFDP2, CDC7, LMO1, TYMS, LIPG, C5orf30, PRMT5, ILDR2, EGFR, E2F7, LIMD1, UNG, CCND2, WRN
HGG-G34R.V_vs_HGG-H3.3-K27M-pons	VSVZ-2 aNSC+TAC+NB	Mouse adult	Mizrak et al 2019	2.3679848448969926e-4	4.824456651540483e-4	0.6294200808240029	2.4215417834640975	DLX1, DLX2, ARX, CDCA3, KIAA0101, MCM6, CENPH, SPC24, MCM7, MCM5, CDCA8, LMNB1, CDK1, TOP2A, DUT, NASP, NCAPD2, RACGAP1, FAM64A, SMC4, TMPO, HMGB3, BIRC5, RBM3, CKS1B, H2AFZ, TYMS, PBK, CDCA7, HMGN4, HMGN4, TUBB, C11orf31, HN1, LIG1, HNRNPAB, MDK, UBE2C, DCX, H2AFX, TIAM2, CCND2
HGG-G34R.V_vs_HGG-H3.3-K27M-pons	MGE Progenitors 8	Human fetal	Nowakowski et al 2017	2.3872045834328001e-4	4.824456651540483e-4	0.6087725381996079	2.3881182264557363	DLX1, DLX2, GAD2, DLX6, DLX5, METAP1D, CDK6, CLSPN, BAZ1A, WDR70, GINS2, TMSB4X, BEST3, MCM2, E2F2, HAT1, HMGN2, RBL1, HELLS, TCF3, CORO1C, CITED2, MYO1B, ZC3H12C, RNASEH2B, USP1, LMO1, TUBA1B, NUDT1, CDCA7, CENPF, RND3, UPF3B, ILDR2, BAZ2B, SP9, CCNE2, PSMB2, CCND2, CRB1, FBXW7
HGG-G34R.V_vs_HGG-H3.3-K27M-pons	earlyRG	Human fetal	Nowakowski et al 2017	2.3872045834328001e-4	4.824456651540483e-4	0.5476897029617201	2.1484999404755585	NR2E1, OTX1, CDCA3, RAD51AP1, AJUBA, PCNA, PCNA, KIAA0101, CENPN, KIF15, SPC24, CDC25C, HIST1H4C, TTK, HMGN2, NDC80, HIST1H1E, HIST1H1C, FAM64A, CENPU, NCAPG, PRC1, CENPE, PTTG1, CDKN3, CENPW, CKS1B, TNFRSF19, LEF1, TYMS, TFAP2C, PBK, SNHG15, SNHG15, SNHG15, SNHG15, HIST1H2BK, TRIAP1, TSPAN6, VIM, TAF9, UBE2C, DARS
HGG-G34R.V_vs_HGG-H3.3-K27M-pons	Dorsal radial glial cells	Mouse E12.5	Jessa et al 2019	2.3872045834328001e-4	4.824456651540483e-4	0.5362885700982697	2.1037751024039006	DMRTA2, EMX2, MCM3, MCM6, EMX1, HES5, MCM7, GINS2, MCM5, MCM2, DUT, MCM4, RPA2, FEZF2, HELLS, DEK, LHX2, DCTPP1, FABP7, LYAR, CDCA7, SIVA1, PAX6, RANBP1, PLAGL1, MDK, VIM, MYCN, TCF4, FKBP3, UNG, MPPED2, CCND2, MT1E, PFN1, MT2A, NEUROG2, GAS1, HES1
HGG-G34R.V_vs_HGG-H3.3-K27M-pons	VSVZ-1 aNSC+TAC+NB	Mouse adult	Mizrak et al 2019	2.3747328425552126e-4	4.824456651540483e-4	0.5415001244563349	2.1019067711693227	DLX1, DLX2, ARX, GAD2, DLX5, PCNA, KIAA0101, SPC24, MCM7, CDCA8, TOP2A, DUT, SMC4, HMGB3, PTTG1, BIRC5, RBM3, CKS1B, H2AFZ, TUBA1B, TYMS, PBK, CDCA7, HMGN4, TUBB, C11orf31, HN1, LIG1, RANBP1, HNRNPAB, SP9, MDK, UBE2C, DCX, H2AFX, TIAM2, CCND2
HGG-G34R.V_vs_HGG-H3.3-K27M-pons	MGE newborn neurons 4	Human fetal	Nowakowski et al 2017	2.3872045834328001e-4	4.824456651540483e-4	0.532857577923453	2.0903158636351176	DLX1, DLX2, ARX, GAD2, DLX6, DLX5, TAC3, TMEM2, TMSB4X, BEST3, NUP43, LHX6, GAD1, CORO1C, PLS3, SNTG1, MYO1B, RND3, EXOC1, SOX1, SP9, DCX, SLC25A3, PSMD7, SP3, FBXW7
HGG-G34R.V_vs_HGG-H3.3-K27M-pons	Dorsal radial glial cells	Mouse E15.5	Jessa et al 2019	2.4189646831156264e-4	4.837929366231253e-4	0.45212791595315904	1.7949516536781935	NR2E1, EMX2, TEAD2, MCM3, MCM6, HES5, GINS2, MCM5, MCM2, HELLS, DEK, LHX2, SUB1, DCTPP1, H2AFZ, FABP7, CDCA7, SIVA1, PAX6, SLC1A3, RANBP1, PLAGL1, MDK, VIM, FKBP3, UNG, CCND2, MT1E, MT1E, PFN1, MT2A, MT2A, GAS1, HES1, GSR, GLO1, APRT, YBX1, HNRNPF, METTL1, EIF5A, SOX9, MT1G, MT1G, MT1H, MT1H
HGG-G34R.V_vs_HGG-H3.3-K27M-pons	MGE newborn neurons 1	Human fetal	Nowakowski et al 2017	2.3872045834328001e-4	4.824456651540483e-4	0.45203703613843255	1.7732696816906393	DLX1, DLX2, ARX, GAD2, DLX6, DLX5, TMEM2, METAP1D, CDK6, ARL4D, BEST3, LHX6, GAD1, SMARCD1, PLS3, PDGFD, FAM214A, MYO1B, LRRC40, PLXNA2, ST8SIA5, RND3, SOX1, SP9, DCX, CCNE2, FNBP1L, CRB1, KIAA1731
HGG-G34R.V_vs_HGG-H3.3-K27M-pons	Str/SVZ 8-Neurogenic progenitor	Mouse P9	Anderson et al 2020	4.772130756382725e-4	9.185053825779536e-4	0.44443427281510095	1.7309386672232132	DLX1, DLX2, GAD2, SP8, DLX5, SYNPR, CDCA7L, ROBO2, CITED2, CDCA7, SEL1L3, PAX6, HMGN4, RND3, TUBB, HN1, MAML3, HNRNPAB, SP9, MDK, VIM, TCF4, TIAM2, MPPED2, CCND2, NUDT4, TP53I11
HGG-G34R.V_vs_HGG-H3.3-K27M-pons	CGE/LGE-derived inhibitory neurons	Human fetal	Nowakowski et al 2017	4.7744091668656003e-4	9.185053825779536e-4	0.4275992898476192	1.6774042743856583	DLX1, DLX2, ARX, GAD2, DLX6, SP8, SCGN, DLX5, MAGI1, LINC00461, GAS2L3, GAD1, PLS3, IBTK, RPP30, FAM214A, BMS1, ST8SIA5, RND3, SOX1, STRIP1, CDH2, TCF4
HGG-G34R.V_vs_HGG-H3.3-K27M-pons	Str/SVZ 35-Mural	Mouse P9	Anderson et al 2020	9.553379508000956e-4	0.001692791807558064	0.42515587245475783	1.6617123412125265	TBX2, SLC38A11, PDE3A, INPP4B, LHFP, RHOJ, HIGD1B, CYSLTR2, RGS5, ARHGAP29, PLXDC1, GJA4, HEYL, SLC16A12, COL3A1, APOLD1, VTN, EMCN, ITGA1, ADAP2, NOTCH3, NID1, COBLL1, COL1A2, FOXC1, ARHGAP42, COL4A1, PCDH18, PDGFRB, TBX18, ITIH5, COL4A2, MNDA, LAMA4, FLT1, EVA1B, RCSD1, CD248, GPER1, ANO1
HGG-G34R.V_vs_HGG-H3.3-K27M-pons	MGE newborn neurons 5	Human fetal	Nowakowski et al 2017	9.548818333731201e-4	0.001692791807558064	0.4197870364787207	1.646758042025815	DLX1, DLX2, ARX, GAD2, DLX6, DLX5, TMEM2, ARL4D, BEST3, LHX6, GAD1, PLS3, RND3, SYNRG, PSMC1, DCX, CRB1, TCEB3, SNW1, CORO2B, RDH11, KITLG, C20orf194, PIP5K1B, CDK19, ABCA1, KIAA1841, KIAA1715, SACS, HTATSF1, EIF5A, SOX4, CARHSP1, CARHSP1, TMEM123, ZNF536
HGG-G34R.V_vs_HGG-H3.3-K27M-pons	Pericytes	Mouse E12.5	Jessa et al 2019	9.528346831824678e-4	0.001692791807558064	0.4239624516259579	1.6410157017622444	TBX2, RHOJ, CRIP1, TAGLN, SEPT11, RGS5, GJA4, HEYL, COL3A1, APOLD1, VTN, ITGA1, LRRC32, PCOLCE, NID1, FOXS1, FOXF2, COX4I2, ECSCR, RASGRP2, COL4A1, PCDH18, C1orf54, PDGFRB, FSTL1, TBX18, ESAM, PFN1, COL4A2, SEPT7, PPIC, TMEM51, TGFB1, EVA1B, RCSD1, CD248, GPER1
HGG-G34R.V_vs_HGG-H3.3-K27M-pons	MGE newborn neurons 2	Human fetal	Nowakowski et al 2017	0.0014323227500596801	0.0024728991069406445	0.4097258771990512	1.607289708046573	DLX1, DLX2, ARX, GAD2, DLX6, DLX5, TMEM2, C17orf85, LHX6, GAD1, PLS3, CITED2, HIST1H2BD, ORMDL1, KAT7, ST8SIA5, RND3, TRAPPC6B, SOX1, SP9, DCX, PDCL
HGG-G34R.V_vs_HGG-H3.3-K27M-pons	Excitatory neuron intermediate progenitor cells 2	Mouse E15.5	Jessa et al 2019	0.0019097636667462401	0.0032147688390228375	0.40783780684266313	1.5998831071439503	DMRTA2, SYNE2, TEAD2, E2F1, EOMES, EMX1, MAGI1, VPS37B, FAM210B, CORO1C, LHX2, MYO10, ARL6IP6, TFAP2C, IGFBP2, LZTS1, CDK2AP1, MDK, SPSB4, CCND2, NRP1, DHRS4L2, MFAP4, DHRS4, POLR3K, DLL1, NEUROG2, CD164, F2R, UBXN2A, ABCD2, MFNG, DCAF8
HGG-G34R.V_vs_HGG-H3.3-K27M-pons	Mural/Pericyte	Human fetal	Nowakowski et al 2017	0.0035808068751492002	0.005786583910241108	0.40053874193330335	1.5712500318122733	SLC38A11, INPP4B, LAMC3, ENPEP, CDH6, HIGD1B, CYSLTR2, RGS5, ARHGAP29, TMEM204, AVPR1A, HEYL, ITGA1, NODAL, LRRC32, NOTCH3, OLFML2A, NID1, COBLL1, FOXF2, ARHGAP42, COL4A1, GPR116, PCDH18, PDGFRB, CCDC3, TBX18, SULT1E1, ITIH5, ANPEP, COL4A2, ITGA11, LAMA4, UNC5B, ADCY4, ARHGDIB, CD248, GPER1, ITGA4, ABCA9, GNG11, CFH, CFH, CFH, CFH, CFH
HGG-G34R.V_vs_HGG-H3.3-K27M-pons	Intermediate Progenitor Cells EN-like 3	Human fetal	Nowakowski et al 2017	0.0035808068751492002	0.005786583910241108	0.39670709488727535	1.5562190874549173	SNCAIP, TEAD2, TMTC2, TGIF2, TGIF2, EOMES, MAGI1, HEG1, CORO1C, TMX1, MYO10, CCNB1IP1, TMEM158, TFAP2C, LZTS1, GPC2, PAX6, LPPR4, SYNRG, MDK, RRP8, LIMD1, FJX1, RASGRP1, MFAP4, POU2F1, NKAIN3
HGG-G34R.V_vs_HGG-H3.3-K27M-pons	Cortical inhibitory neurons	Mouse P0	Jessa et al 2019	0.006212251941328731	0.009803710094909403	-0.3971685583466058	-1.4954883422890208	GNAL, NNAT, INA, CELF5, SYT1, GRM5, ACTL6B, STMN2, NSG2, NSG1, LYPD1, FOXP2, BZW2, MAPK10, ADORA2A, PPP3CA, RUNX1T1, TUBB3, PLCXD3, ZNF503, STMN3, SYT6, SYT5, APLP1, CELF4, UCHL1, FOXP1, RXRG, RGS17, ELAVL3, ELMO1, KIF26A, STMN4, BCL11B, CSRNP3, GNG2, GAP43, DPF1, GUCY1A3, TUBB2B, ZCCHC18, SNRPN, CCL27, CCL27, CCL27, CCL27, CCL27, CCL27, CCL27, PHACTR1
HGG-G34R.V_vs_HGG-H3.3-K27M-pons	MGE-derived Ctx inhibitory neuron, Germinal Zone Enriched	Human fetal	Nowakowski et al 2017	0.0055049028040598654	0.008755829656851125	-0.3984909111932631	-1.4993328727382957	NXPH1, RBP1, TENM2, FAM135B, NMNAT2, AKR1C1, AKR1C1, AKR1C1, AKR1C1, PDE4DIP, MAGI2, BMP3, GRIA4, ERO1LB, CADPS, GRIP1, CXCR4, NBEA, MAPK10, PTPRT, RUNX1T1, BEND4, DSCAML1, RIMS1, DPYSL3, CELF4, SPPL3, ST8SIA4, FNBP1, ACKR3, NCOA2, SLCO5A1, SATB1, ELMO1, NTN4, SOX6, BRINP2, CAMTA1, TRERF1, GRIK3, ZNF608, CDK14
HGG-G34R.V_vs_HGG-H3.3-K27M-pons	Str/SVZ 3-Astrocytes	Mouse P9	Anderson et al 2020	0.0063672345551540185	0.009970398295667532	-0.40288333310367486	-1.506425692279939	GABBR2, SLC7A10, ZFPM2, LUZP2, ID3, CST3, RORA, PTPRT, ADCYAP1R1, GPC5, CPE, ATP1A2, SPARCL1, WDR17, CDH10, FRMD4A, FNBP1, BCL2, GLUL, BCAN, NCKAP5, DTNA, PPP1R3C, GLUD1, TRPS1, HAPLN1, GRAMD3, MMD2, RGS20, RGMA, AQP4, NWD1, ID2, PTN, NRCAM, SLC39A12, FGFR3, TIMP3, SLC1A4, TNC, APOE, PHYHIPL, NTM, RASA2
HGG-G34R.V_vs_HGG-H3.3-K27M-pons	Newborn Excitatory Neuron - early born 2	Human fetal	Nowakowski et al 2017	0.0039566488904180285	0.006343199014797157	-0.4058470631759267	-1.5270105942989702	ST8SIA1, NFASC, SLC17A6, RNF182, PAK7, HS3ST1, RBFOX1, CTTNBP2, NKAIN1, WWC1, TSPAN13, PHACTR3, PRDM8, GNG4, SCRT2, SH3BGRL2, ADCYAP1R1, SORBS2, KIAA1324, RBFOX3, PTCHD2, PPP2R2B, CNTN2, DOK6, ST3GAL6, RASGEF1B
HGG-G34R.V_vs_HGG-H3.3-K27M-pons	Astrocytes 2	Mouse P0	Jessa et al 2019	0.002385414891804396	0.003949621378233508	-0.4083986285020098	-1.5690462914382857	SLC7A10, GRM5, OLIG1, CLDN10, RAMP1, ID3, ALDH1L1, CBS, CST3, GLUD2, METRN, GJA1, CPE, ATP1A2, TIMP4, SPARCL1, TSC22D4, ID1, SERPINE2, GLUL, ALDOC, BCAN, TMEM229A, PPP1R3C, MGST1, GLUD1, PLA2G7, MMD2, VCAM1, GNG12, AQP4, PTN, MT1HL1, MT1HL1, MT1B, MT1B, FGFR3, SLC25A18, MT1A, MT1A, GSTM5, FADS2, TNC, CA8, SCRG1, APOE, NDRG2, SCD, SCD, PHYHIPL
HGG-G34R.V_vs_HGG-H3.3-K27M-pons	Cortical inhibitory neurons	Mouse E12.5	Jessa et al 2019	0.002073971655720705	0.003462332846740351	-0.4297425747844018	-1.5905025167095619	NEFM, NNAT, INA, L1CAM, SYT1, ACTL6B, RAB3C, RTN1, STMN2, TAGLN3, TSHZ2, RAB3A, NSG1, LY6H, BEX2, TUBB4A, RGS2, CELF3, RUNX1T1, TUBB3, RUFY3, CD200, STMN3, DPYSL3, APLP1, CELF4, UCHL1, POU3F1, NAP1L5, ELAVL3, ANK3, STMN4
HGG-G34R.V_vs_HGG-H3.3-K27M-pons	Astrocytes 2-2	Mouse P6	Jessa et al 2019	0.001725625539257981	0.0029292131002530437	-0.4233963083356791	-1.5942456420018047	CLDN10, ID3, SOCS3, PPP1R3G, ALDH1L1, CBS, CST3, GLUD2, DUSP1, GJA1, CPE, ATP1A2, PMM1, SPARCL1, DHCR7, BTBD17, ID1, CSRNP1, PDE10A, TGFB2, GLUL, ALDOC, BHLHE40, BCAN, MSMO1, PPP1R3C, GLUD1, PLA2G7, MMD2, JUNB, VCAM1, AQP4, ID2, PTN, GPM6A, MRAS, GSTM5, FADS2, FEZ1, CA8, CHRDL1, NDRG2, PHYHIPL, JUN, LCAT, NR4A2
HGG-G34R.V_vs_HGG-H3.3-K27M-pons	MGE-derived Ctx inhibitory neuron, Cortical Plate-enriched	Human fetal	Nowakowski et al 2017	0.0012041974883880955	0.0020969645918482356	-0.4282351896460011	-1.6112465279996644	NXPH1, TENM2, FAM135B, NMNAT2, KCNA3, SYT1, SNAP25, THRB, VSTM2A, PDE4DIP, MAGI2, BMP3, GRIA4, LPHN3, ERO1LB, CADPS, GRIP1, CXCR4, MAPK10, PTPRT, XKR4, RUNX1T1, LINC00599, RPH3A, RIMS1, CELF4, ST8SIA4, FNBP1, ACKR3, PARP8, FHL1, NTN4, TTC21B, SOX6, BRINP2, JARID2, TRERF1, CDK14, CSRNP3
HGG-G34R.V_vs_HGG-H3.3-K27M-pons	Astrocytes 2	Mouse P3	Jessa et al 2019	0.0010231923601637107	0.0017972596239397354	-0.428212496988855	-1.6265122006270776	SLC7A10, LUZP2, GRM5, CLDN10, RAMP1, ID3, ALDH1L1, CBS, CST3, GLUD2, GJA1, CPE, ATP1A2, SPARCL1, BTBD17, TSC22D4, SERPINE2, GLUL, ALDOC, BCAN, MSMO1, TMEM229A, GABRG1, MGST1, GLUD1, CD81, PLA2G7, MMD2, VCAM1, GNG12, AQP4, PTN, GPM6A, MT1HL1, MT1B, FGFR3, SLC25A18, MT1A, GSTM5, TIMP3, FADS2, FEZ1, TNC, APOE, NDRG2, SCD, PHYHIPL
HGG-G34R.V_vs_HGG-H3.3-K27M-pons	VSVZ-1 Astrocyte	Mouse adult	Mizrak et al 2019	0.0017205781142463868	0.0029292131002530437	-0.4362674808820022	-1.62664808171127	SLC7A10, NTRK2, LUZP2, LSAMP, CLDN10, C1orf198, SCG3, AGT, ENHO, ALDH1L1, ACSL6, SDC4, CLU, CPE, ATP1A2, TIMP4, SPARCL1, BTBD17, GJB6, NKAIN4, ALDOC, NTSR2, BCAN, GPLD1, KCNK1, MGST1, GLUD1, PLA2G7, ENTPD2, MMD2, TMEM47, AQP4, PRNP, ID2, FAM107A, GPM6A, SLC39A12, FGFR3, SLC25A18
HGG-G34R.V_vs_HGG-H3.3-K27M-pons	Astrocytes 2	Mouse P6	Jessa et al 2019	5.122076148198737e-4	9.447066031250146e-4	-0.44484314062726876	-1.687690710999576	SLC7A10, LUZP2, GRM5, CLDN10, RAMP1, SCG3, ENHO, ATP1B1, ALDH1L1, CBS, CST3, GABBR1, CLU, GLUD2, GJA1, CPE, ATP1A2, PMM1, SPARCL1, BTBD17, TSC22D4, SERPINE2, GLUL, ALDOC, BCAN, MSMO1, GLUD1, CD81, PLA2G7, MMD2, VCAM1, AQP4, ID2, PTN, SPCS3, GPM6A, MT1HL1, MT-CO3, MT1B, SLC25A18, MT1A, GSTM5, FEZ1, APOE, NDRG2, SCD, PHYHIPL
HGG-G34R.V_vs_HGG-H3.3-K27M-pons	Fibrous astrocytes	Human ped/adult	Velmeshev et al 2019	5.191209551825575e-4	9.447066031250146e-4	-0.46387187639322147	-1.7140800540559753	NTRK2, GFAP, LSAMP, GLIS3, CST3, RORA, RP11-384F7.2, ARHGEF4, CLU, GPC5, CAMK2G, ADCY2, CPE, CSGALNACT1, ATP1A2, NEBL, SPARCL1, PRKCA, PTGDS, CTNND2, PRODH, CTNNA2, GLUL, ABLIM1, FMN2, DTNA, DPP10, SORBS1, GLUD1, MMD2, RGS20, TNIK, AQP4, GPM6A, HPSE2, DST, RYR3, FGFR3
HGG-G34R.V_vs_HGG-H3.3-K27M-pons	Cortical inhibitory neurons	Mouse E15.5	Jessa et al 2019	5.180452426178552e-4	9.447066031250146e-4	-0.4686235966784552	-1.7432800535163995	NEFM, NNAT, INA, ACTL6B, RTN1, STMN2, TSHZ2, LSAMP, VSTM2A, NSG1, RBFOX1, LY6H, TLE4, FAM57B, TSPAN13, FOXP2, SHANK1, INPP5F, RGS2, RUNX1T1, TUBB3, ZNF503, CD200, STMN3, SYT5, DPYSL3, APLP1, SYBU, CELF4, UCHL1, FOXP1, POU3F1, APBB2, NAP1L5, ELAVL3, STMN4, DLK1, THSD7A, VCAN, BCL11B, PGRMC1, GAP43, TUBB2B, ZCCHC18, SNRPN
HGG-G34R.V_vs_HGG-H3.3-K27M-pons	VSVZ-1 Ependymal	Mouse adult	Mizrak et al 2019	3.471017007983339e-4	6.807237238957616e-4	-0.4794429053561519	-1.7548108722918174	PCP4L1, AEBP1, RSPH1, C5orf49, TMEM212, SNCG, C2orf40, DYNLRB2, CAPSL, DRC1, EFCAB1, RIIAD1, MIA, MORN5, RSPH4A, PIFO, C2orf50, DMKN, PRELP, PPP1R36, IQCA1, MLF1, NME5, COL8A2, GAS6, C2orf70, FOXJ1, C9orf116, CCDC146, CCDC153, SPA17, DNAH6, RARRES2, TEKT1, C9orf24, FAM166B, LRRC23, LBP, CDHR4, EFCAB10, SPINT2, CCDC33
HGG-G34R.V_vs_HGG-H3.3-K27M-pons	Str/SVZ 2-Progenitor	Mouse P9	Anderson et al 2020	5.161734342739161e-4	9.447066031250146e-4	-0.4755875888918295	-1.7732553377404328	PCP4L1, PPP1R1A, TTC9B, HPCAL4, SPTBN2, COL19A1, PSD, CST3, CPLX2, SEPW1, YWHAG, CPE, CALM3, SERP2, DYNLL1, MGST3, KIF1A, SLC26A8, MIF, RASL10B, DDN, MAP1LC3A, FTH1, NDUFC1, PCP4, ATP5E
HGG-G34R.V_vs_HGG-H3.3-K27M-pons	VSVZ-2 Astrocytes	Mouse adult	Mizrak et al 2019	1.7208742040956807e-4	4.824456651540483e-4	-0.4789500676787235	-1.7908476920905012	SLC7A10, NTRK2, LUZP2, LSAMP, CLDN10, SCG3, AGT, ENHO, ALDH1L1, CST3, ACSL6, SDC4, CLU, S100A1, CPE, ATP1A2, TIMP4, SPARCL1, BTBD17, GJB6, SERPINE2, NKAIN4, GLUL, ALDOC, NTSR2, BCAN, KCNK1, MGST1, GLUD1, CD81, PLA2G7, ENTPD2, MMD2, TMEM47, VCAM1, AQP4, PRNP, ID2, FAM107A, PTN, GPM6A
HGG-G34R.V_vs_HGG-H3.3-K27M-pons	Cortical excitatory neurons 2	Mouse P0	Jessa et al 2019	1.7208742040956807e-4	4.824456651540483e-4	-0.47962327975912833	-1.7933649071027542	OPCML, SYT4, ACTL6B, RTN1, STMN2, RNF182, NSG2, TAGLN3, RAB3A, NSG1, RBFOX1, CTTNBP2, LY6H, ITSN1, TUBB3, CAMK2B, STMN3, DPYSL3, APLP1, SEPT3, UCHL1, KCTD4, PPP2R2B, CNTN2, RASGEF1B, EDIL3, CALB2, ELAVL3, NEUROD6, ANK3, SNCA, NTRK3, NEUROD1, GRIA2, KCNK1, THRA, GAP43, ZNF385B, TUBB2B, TTC3
HGG-G34R.V_vs_HGG-H3.3-K27M-pons	Cortical excitatory neurons	Mouse E12.5	Jessa et al 2019	1.7205781142463867e-4	4.824456651540483e-4	-0.4859195811999048	-1.8117787579004883	CBLN2, INA, SLC17A6, SYT4, KIF21B, RTN1, STMN2, NSG2, TAGLN3, RAB3A, NSG1, SORBS2, PLXNA4, TUBB3, RUFY3, PCDH9, RBFOX3, STMN3, CACNA2D1, DPYSL3, CELF4, UCHL1, PPP2R2B, MYT1L, ELAVL3, NEUROD6, ANK3, SERPINI1, SRRM4, NEUROD1, GRIA2, BCL11B, THRA, NAV1, PCP4, TUBB2B, TTC3, MAP2, ID2, NEUROD2, GPM6A, SSTR2
HGG-G34R.V_vs_HGG-H3.3-K27M-pons	Ependymal	Mouse P0	Jessa et al 2019	1.7418568193694478e-4	4.824456651540483e-4	-0.5258904443881038	-1.9103714595837349	CCNA1, SPAG6, SPAG17, C10orf105, RSPH1, DNAH3, C5orf49, TMEM212, LRRC34, FAM183A, PLIN5, TCTEX1D1, TCTE1, MORN5, RSPH4A, PIFO, CDS1, MAPK15, DMKN, IQCA1, MAATS1, C2orf70, FAM216B, FOXJ1, SYT10, SLC17A8, C9orf116, ZMYND10, CCDC153, DLEC1, WDR78, DNAH6
HGG-G34R.V_vs_HGG-H3.3-K27M-pons	Cortical excitatory neurons 1	Mouse E15.5	Jessa et al 2019	1.7208742040956807e-4	4.824456651540483e-4	-0.5114263811782231	-1.9122802484320527	WNT7B, JPH4, INA, HECW1, ARPP21, SYT4, ACTL6B, RTN1, STMN2, SNAP25, TAGLN3, SH3GL2, ALCAM, RAB3A, NSG1, RBFOX1, FAM49A, GPR85, BZW2, LRFN5, RUNX1T1, TUBB3, PCDH9, STMN3, DPYSL3, PPP2R2B, CNTN2, DYNLL1, MYT1L, ELAVL3, NEUROD6, ANK3, MPPED1, SERPINI1, ZNRF2, PPP1R14C, GRIA2, BCL11B, THRA, GAP43, TUBB2B, IFNGR2, TNIK, ID2, NEUROD2, GPM6A
HGG-G34R.V_vs_HGG-H3.3-K27M-pons	VSVZ-2 Ependymal	Mouse adult	Mizrak et al 2019	1.7433751743375174e-4	4.824456651540483e-4	-0.5286893202156099	-1.915229948694749	AEBP1, RSPH1, C10orf107, TMEM212, C2orf40, DYNLRB2, CAPSL, EFCAB1, RIIAD1, MIA, MORN5, RSPH4A, PIFO, C2orf50, DMKN, FAM47E, PPP1R36, IQCA1, MLF1, NME5, COL8A2, C2orf70, FAM216B, FOXJ1, C9orf116, CCDC146, CCDC153, AKAP14, SPA17, IQCG, DNAH6, RARRES2, TEKT1, C9orf24, FAM166B, LRRC23, LBP, CDHR4, EFCAB10
HGG-G34R.V_vs_HGG-H3.3-K27M-pons	Ependymal progenitors	Mouse P3	Jessa et al 2019	1.7126220243192326e-4	4.824456651540483e-4	-0.5062273180446484	-1.917598571334311	NTRK2, SPAG6, C10orf105, ITM2C, RSPH1, TPPP3, DYNLRB2, CAPSL, FAM183A, DRC1, LRRIQ1, EFCAB1, RIIAD1, C7orf57, CLU, GJA1, MORN5, RSPH4A, PIFO, CCDC39, MAPK15, C2orf50, DMKN, TSPAN15, PPP1R36, FHL1, MLF1, NME5, NKAIN4, LPAR1, PACRG, FOXJ1, C9orf116, TCP11L2, ENTPD2, IQCG, CYSTM1, WDR78, TMEM47, RARRES2, TEKT1, C9orf24, SLIT2, LRRC23, HSPA2, PIH1D2, MT1HL1, MT1HL1, SPEF2, MT1B, MT1B, MT1A, MT1A, DCDC2, CCDC74B, S100A6, ANXA5, SHISA8
HGG-G34R.V_vs_HGG-H3.3-K27M-pons	Early and Late Born Excitatory Neuron PFC	Human fetal	Nowakowski et al 2017	1.720282126268708e-4	4.824456651540483e-4	-0.5122698833945026	-1.9274293448431763	PRKG2, GNAL, NEFM, L1CAM, SYT1, ACTL6B, HILPDA, ATP8A2, RBFOX1, LPHN3, PRDM8, AKR1C2, AKR1C2, AKR1C2, AKR1C2, AKR1C2, AKR1C2, AKR1C2, AKR1C2, AKR1C2, GPR85, KIAA1644, VSTM2L, CACNA2D1, APLP1, KIF3A, RNF150, PKIA, NCDN, DISP2, MB21D2, SPOCK1, ZNF827, MPPED1
HGG-G34R.V_vs_HGG-H3.3-K27M-pons	Str/SVZ 18-Interneurons	Mouse P9	Anderson et al 2020	1.719986240110079e-4	4.824456651540483e-4	-0.5132318677804624	-1.928723053972081	MEGF11, NXPH1, CRTAC1, NNAT, OPCML, ADCY8, TMEM130, TRHDE, CRABP1, LGR5, VWC2, RBFOX1, NYAP2, ERC2, OLFM2, LRRTM4, GRIA4, ABLIM3, DNER, GRIP1, VSNL1, ASTN2, PPM1L, XKR4, DLGAP2, KCNC2, ZMAT4, KCNMB2, KIT, PCDH15, ADAMTS17, CHRM2, IQSEC3, MYT1L
HGG-G34R.V_vs_HGG-H3.3-K27M-pons	Ependymal	Mouse P3	Jessa et al 2019	1.742767514813524e-4	4.824456651540483e-4	-0.5477974410842825	-1.9814024874528926	CCNA1, SPAG6, SPAG17, RSPH1, C5orf49, TMEM212, DYNLRB2, LRRC34, CAPSL, FAM183A, MORN5, RSPH4A, PIFO, MAPK15, C2orf50, DMKN, SPEF1, PPP1R36, IQCA1, MAATS1, C2orf70, FOXJ1, SLC17A8, C9orf116, ZMYND10, CCDC146, LRRC6, CCDC153, IQCG, DNAH6, C9orf24, DNAH10, LRRC23, SPEF2, EFCAB10, SPAG8, SPINT2, CCDC180
HGG-G34R.V_vs_HGG-H3.3-K27M-pons	Cortical excitatory neurons 1	Mouse P0	Jessa et al 2019	1.7208742040956807e-4	4.824456651540483e-4	-0.5363796924154837	-2.005583460718558	TENM2, ARPP21, OPCML, SYT4, RTN1, STMN2, NSG2, RAB3A, NSG1, RBFOX1, FAM19A2, LY6H, NCAM1, TSPAN13, FAM49A, GPR85, NBEA, BZW2, KIAA1549L, PLXNA4, RUNX1T1, TUBB3, STMN3, PPFIA2, DPYSL3, CLSTN2, MACROD2, APLP1, SERP2, UCHL1, CNTN2, TSC22D1, FRMD4A, POU3F1, MYT1L, MIF, ELAVL3, NEUROD6, MPPED1, STMN4
HGG-G34R.V_vs_HGG-H3.3-K27M-pons	Astrocytes 3	Mouse P6	Jessa et al 2019	1.7064846416382253e-4	4.824456651540483e-4	-0.5302316248846349	-2.046834353236509	NTRK2, PPP1R1A, GFAP, HSPB8, RNF182, FBXO2, MSX2, SCG3, ID3, ATP1B1, PRKAG2, SOCS3, ZNF423, C4A, C4B, CLU, GLUD2, GJA1, CPE, FXYD6-FXYD2, C4orf3, C4orf3, FXYD6, CIDEA, TSC22D4, ALDOC, NTSR2, HLA-DQB1, DTNA, PPP1R3C, MGST1, GLUD1, CD81, ENTPD2, CCDC80, MMD2, JUNB, TMEM47, PTER, AQP4, ID2, HSPA2, GPM6A, MT1HL1, MT1HL1, IGFBP5, CXXC5, MT1B, MT1B, MT1A, MT1A, GSTM5, CD74, TNC, HLA-DQB2, CCDC74B, S100A6, APOE, NDRG2, SHISA8
HGG-G34R.V_vs_HGG-H3.3-K27M-pons	Oligodendrocytes	Human ped/adult	Velmeshev et al 2019	1.720282126268708e-4	4.824456651540483e-4	-0.5468158647775413	-2.0574095377501975	DNM3, EXOC6B, DOCK10, MAGI2, MYO1D, FRMD5, SIK3, ABCA2, KLHL32, PCDH9, MARCH1, CERCAM, PIP4K2A, CRYAB, PTGDS, CNDP1, KCNH8, PPP2R2B, CNTN2, CNP, CREB5, DNAJC6, SLC24A2, TMEFF2, PDE4B, MAP7, EDIL3, LPAR1, UGT8, IL1RAPL1, ANK3, AKAP6, ELMO1, MBP, PRUNE2, CDK18, PLCL1, TTLL7, CLDN11, MAP4K4, SH3GL3, PXK, GAB1, SLC44A1, PDE8A, PEX5L, MOBP, DOCK5, SLCO3A1, CTNNA3, C10orf90, SCD, ENPP2, SLC5A11, MAG, SPOCK3, RP11-946L20.2, TRIM2
HGG-G34R.V_vs_HGG-H3.3-K27M-pons	Ependymal	Mouse P6	Jessa et al 2019	1.7433751743375174e-4	4.824456651540483e-4	-0.5822541326190983	-2.1092738398585413	SPAG6, SPAG17, C10orf105, RSPH1, C5orf49, TMEM212, DYNLRB2, CAPSL, FAM183A, DRC1, EFCAB1, RIIAD1, TCTEX1D1, MORN5, RSPH4A, PIFO, CCDC39, MAPK15, C2orf50, DMKN, SPEF1, PPP1R36, IQCA1, MYO16, C2orf70, FAM216B, FOXJ1, C9orf116, ZMYND10, CCDC146, CCDC153, IQCG, WDR78, DNAH6, TEKT1, C9orf24, LRRC23, PIH1D2, SPEF2, EFCAB10, SPAG8, SPINT2, CCDC33
HGG-G34R.V_vs_HGG-H3.3-K27M-pons	Oligodendrocyte precursor cells	Mouse P0	Jessa et al 2019	1.721763085399449e-4	4.824456651540483e-4	-0.566282965430089	-2.1142524847701227	C1QL1, NXPH1, RPRM, G0S2, SOX10, LHFPL3, OLIG2, KCNIP3, KCND2, CNTN1, XYLT1, BRINP3, OLIG1, PCDH11Y, PCDH11X, BCAS1, NCALD, PPP1R16B, SAPCD2, PTPRE, TIMP4, SULF2, CCND1, SMOC1, B3GAT2, DUSP26, PCDH15, SERPINE2, CNP, SOX8, RAP1GAP, NAP1L5, BCAN, SOX6, TMCC3, PPP1R14C, UGDH, LRP1B
HGG-G34R.V_vs_HGG-H3.3-K27M-pons	Astrocytes 3	Mouse P3	Jessa et al 2019	1.7015484090522376e-4	4.824456651540483e-4	-0.5498465937164994	-2.117037224903339	RELN, GFAP, HSPB8, RAMP1, FBXO2, MSX2, AGT, TMIE, ID3, PRKAG2, SOCS3, ALDH1L1, ZNF423, SDC4, CLU, GLUD2, GJA1, CPE, ATP1A2, FXYD6-FXYD2, SPARCL1, FXYD6, CIDEA, TSC22D4, ID1, CNP, MT-CO1, GRIN3A, NTSR2, BCAN, TNFRSF21, PLEC, MGST1, GLUD1, CD81, GPR37, MMD2, IL6ST, TMEM47, RGMA, AQP4, ID2, TMEM176A, MT1HL1, MT1HL1, IGFBP5, MT-CO3, CXXC5, MT1B, MT1B, SLC25A18, EMB, MT1A, MT1A, GSTM5, TNC, SCRG1, APOE, SCD, PHYHIPL, MARCKS, SHISA8, LCAT, YWHAH
HGG-G34R.V_vs_HGG-H3.3-K27M-pons	Newborn Excitatory Neuron - early born 1	Human fetal	Nowakowski et al 2017	1.720282126268708e-4	4.824456651540483e-4	-0.5626725028031401	-2.11707056884298	MYT1, SLC6A15, JPH4, ZFPM2, FSTL5, HECW1, SYT1, SYT4, EPB41L3, TMEM130, NPTX1, PHYHIP, ERC2, C3orf14, NKAIN1, GLB1L2, PGBD5, PRDM8, ADARB1, B3GAT1, TSPAN18, CFTR, RBFOX3, RCAN3, ACMSD, AUTS2, KIT, DHCR7, PPP2R2B, CNTN2, RASGEF1B, SLC24A2, MMD, WNK2, NEO1, NEUROD6, NDST4, SHISA2, NEUROD1, PPP1R17, DHCR24, THSD7A, BCL11B, SHB, C1orf115, ARHGEF3, SLC17A7, VANGL2, EPHA7, BACH2, TET3, TMEM189, STK17B
HGG-G34R.V_vs_HGG-H3.3-K27M-pons	Cortical excitatory neurons 2	Mouse E15.5	Jessa et al 2019	1.719986240110079e-4	4.824456651540483e-4	-0.5662571873043312	-2.127991966583074	NNAT, INA, HECW1, ARPP21, SYT4, ACTL6B, RTN1, STMN2, NSG2, TAGLN3, REEP1, SNCB, RAB3A, NSG1, LY6H, DNER, NCAM1, BEX2, TSPAN13, GPR85, BZW2, PLXNA4, TUBB3, FXYD6-FXYD2, PCDH9, FXYD6, CD200, STMN3, DPYSL3, APLP1, CELF4, SERP2, UCHL1, MYT1L, ELAVL3, ANK3, STMN4, KIFAP3, PPP1R14C, GRIA2, ANKRD12, C16orf45, THRA, GNG2, GAP43, TUBB2B, SNRPN, EPHA7, APP, NEUROD2, GPM6A, NR2F2
HGG-G34R.V_vs_HGG-H3.3-K27M-pons	Glycolysis	Human fetal	Nowakowski et al 2017	1.720282126268708e-4	4.824456651540483e-4	-0.5658985572465488	-2.1292086862764794	NTRK2, PTPRN, CDKN1A, RAB3A, FGF14, NR6A1, PEG3, VWA5A, VWA5A, TXNIP, PPP2R2C, ATP1A3, P4HA1, DACT3, NEBL, PRKCB, SLC3A1, NSF, DHCR7, ZMAT3, NIPAL3, HK2, PDK1, CARS, BNIP3, AMPD2, FAM162A, FABP3, FABP3, ZRSR2, ZRSR2, STC1, INSIG2, PFKP, EGLN3, STX1A, NUP210L, DCUN1D2, GUCY1A3, ENO2, DEAF1, VEGFA, CNN2, PGK1, PGK1, DDIT4, PFKFB4, CLEC4A, CLEC4A, CLEC4A, CLEC4A, CLEC4A, CLEC4A, CYP51A1, SPINT2
HGG-G34R.V_vs_HGG-H3.3-K27M-pons	VSVZ-1 Oligodendrocyte	Mouse adult	Mizrak et al 2019	1.7208742040956807e-4	4.824456651540483e-4	-0.5776733960171845	-2.159985221535472	EFNB3, SEZ6L2, OLIG1, TPPP3, NDRG1, MAPK8IP1, DNAJB2, BIN1, CMTM5, TUBB4A, LGI3, TSPAN2, HAPLN2, CRYAB, PTGDS, TPPP, DESI1, DUSP26, FA2H, APLP1, PDLIM2, CNP, PLEKHB1, TMEFF2, CSRP1, LPAR1, SEPT8, UGT8, ACOT7, STMN4, APOD, GAMT, SLC48A1, MBP, TMEM151A, TTLL7, CLDN11, GJC2, FTH1, GPR37, SEPT4, TALDO1, APP, RNF7, DEGS1, SLC44A1, PEX5L, MOBP, TMEM88B, EVI2A, PLA2G16, FEZ1, AGPAT4
HGG-G34R.V_vs_HGG-H3.3-K27M-pons	Parvalbumin interneurons	Human ped/adult	Velmeshev et al 2019	1.7250301880282904e-4	4.824456651540483e-4	-0.586122334657613	-2.1635543178538046	NXPH1, CNTNAP5, CPLX1, KCND2, FGF12, ADCY8, AC010127.3, CALN1, BTBD11, EPHA6, KAZN, VWC2, PTCHD4, GRIA4, ANK1, FAM19A2, RP11-123O10.4, DNER, GRIP1, TRPC4, FRMD5, ASTN2, ALK, PTPRM, PLXNA4, GABRG3, PLCXD3, KCNC2, SPARCL1, ZMAT4, SHISA9, SGCZ, ADAMTS17, SLC9A9, RP5-921G16.1, KCNAB1, TMEM132C, MYO16, TENM3, NDST3, CNTNAP3B, FGF13, ZNF804A, SOX6, PLD5, KCTD8, DPP10
HGG-G34R.V_vs_HGG-H3.3-K27M-pons	Early Born Deep Layer/subplate Excitatory Neuron V1	Human fetal	Nowakowski et al 2017	1.720282126268708e-4	4.824456651540483e-4	-0.575224848694678	-2.1642991110669625	GABBR2, RALYL, NTRK2, ZFPM2, CNTN1, OPCML, KHDRBS3, GRM5, NPTX1, SCN2A, WASF1, KAZN, SH3GL2, SULT4A1, NLGN1, GABRA3, LRRTM4, TLE4, SYT16, CHST15, GLB1L2, PAPPA2, PRDM8, VSNL1, IGSF21, B3GAT1, KIAA1644, ELMOD1, VSTM2L, KCNMA1, HS3ST4, AGAP1, SYT6, CLSTN2, KIT, NPAS2, SLC24A2, DYNC1I1, PDZD2, SPOCK1, NEUROD6, PRICKLE2, GABRG2, SERPINI1, KLHL1, SHISA2, DPP10, GRIK3, ADRBK2, GPR37
