Comparison	Cell_type	Age	Dataset	pval	padj	ES	NES	leadingEdge
HGG-G34R.V_vs_HGG-IDH	VSVZ-1 Neuron	Mouse adult	Mizrak et al 2019	2.594706798131811e-4	5.342431335211119e-4	-0.7405605786606291	-2.9086971671554	CELF5, SCN2A, PPP1R1B, UNC80, ATP6V1G2, CDK5R2, ARPP21, GRM5, PTPRN, HPCAL4, GRIN1, VAT1L, PSD, CPLX2, GNAL, PPP3CA, VGF, CALN1, FBXL16, RAB3C, CALY, VSNL1, GAP43, TMEM130, PRKCE, PRKCB, SNAP25, SNCB, SCN2B, RGS9, DDN, RBFOX1, SLC12A5, MYT1L, ADCY5, SPTBN2, KCNIP2, SULT4A1, SH2D5, AGAP2, CELF4, CX3CL1, SYT1, PHYHIP, CAMK2B, NRSN1, DNM1, NRGN, HPCA, ATP1A3, RASGEF1A, PTPN5, RBFOX3, GRIN2A, HAP1, CAMK2A, KCNQ2, DIRAS2
HGG-G34R.V_vs_HGG-WT	Str/SVZ 5-Neurogenic progenitor	Mouse P9	Anderson et al 2020	2.626050420168067e-4	5.343915343915344e-4	0.5019213975101615	2.034702107682413	DLX5, SP9, DLX2, DLX1, SP8, CCNG2, TIAM2, CDCA7, ELAVL4, CCDC34, FAM64A, MPPED2, ATAD2, ASPM, H1FX, TOP2A, NFIB, DEK, ARL6IP1, PFN2, KIF15, SMC4, H1F0, PBK, ECT2, CDCA3, CDK1, ETV1, CDCA2, CCND2, CENPP, BIRC5, HMGB2, NRXN3, TOX3, CKS1B, HMGN4, NEIL3, H2AFZ, CENPE, HDGF, PRC1, LMNB1, NUSAP1, RACGAP1, CENPA, SMC2, ANP32E, SKA2, CDKN2C, DDAH2, MIS18BP1, HMGN1, NUDT4, CENPF, NOL4, TMPO, H3F3B, CCNA2, CASC5, CCNB1, PSRC1
HGG-G34R.V_vs_HGG-WT	MGE Progenitors 8	Human fetal	Nowakowski et al 2017	2.6455026455026457e-4	5.343915343915344e-4	0.4508246549909922	1.8392243461149993	DLX5, METAP1D, DLX6, ST18, SP9, ILDR2, DLX2, DLX1, GAD2, ZC3H12C, FBXW7, BEST3, CORO1C, CITED2, CRB1, ABAT, CDCA7, SH3BGRL, KLHL13, HAT1, MYO1B, CDK6, ASCL1, MTMR4, H1FX, RFTN2, TEAD1, PFN2, H1F0, HMGN2, HNRNPC, WDR70, CCNE2, RNASEH2B, CCND2, RBL1, HMGB2, TOX3
HGG-G34R.V_vs_HGG-WT	MGE newborn neurons 4	Human fetal	Nowakowski et al 2017	7.936507936507937e-4	0.0014574314574314574	0.42170382414409024	1.7204204154076403	DLX5, TAC3, DLX6, SP9, DLX2, SNTG1, DLX1, ARX, GAD2, FBXW7, BEST3, CORO1C, EXOC1, TMEM2, DCX, PGM3, DACH2, MED13, EFNA5, MYO1B, CDK5RAP3, NUP43, WDR48, BIRC2, SOX4, PFN2, AHCTF1, H1F0, TMEM41B, PLS3, ZNF148, NRXN3, TOX3
HGG-G34R.V_vs_HGG-WT	Str/SVZ 35-Mural	Mouse P9	Anderson et al 2020	0.0013206550449022716	0.002303411786170407	0.4074418457661497	1.6571968386664084	SLC38A11, INPP4B, PCDH18, PDE3A, HIGD1B, TBX2, ITGA1, SLC16A12, RGS5, COBLL1, PLXDC1, APOLD1, PDGFRB, CYSLTR2, ARHGAP42, ARHGAP29, NID1, PDE5A, UACA, EMCN, RHOJ, MAST4, KCNJ8, HEYL, EDNRA, ITIH5, COL4A1, SLC6A20, NDUFA4L2, LHFP, GJC1, VTN, TFPI, FN1, LAMA4, GNG11, BMP5, SERPINH1, RCSD1, S1PR3
HGG-G34R.V_vs_HGG-WT	MGE newborn neurons 1	Human fetal	Nowakowski et al 2017	0.0013227513227513227	0.002303411786170407	0.40215083728464757	1.6406503117253735	DLX5, PDGFD, METAP1D, DLX6, ARL4D, SP9, DLX2, DLX1, ARX, GAD2, BEST3, FNBP1L, ABCA1, FAM65B, FAM214A, CRB1, TMEM2, DCX, CCSER1, DACH2, EFNA5, KLHL13, MYO1B, CDK6, SENP7
HGG-G34R.V_vs_HGG-WT	Outer Radial Glia	Human fetal	Nowakowski et al 2017	0.003703703703703704	0.00618304254667891	0.38301991435913574	1.5626020975944184	MOXD1, VEPH1, C8orf4, SLC1A3, SLCO1C1, ARAP2, GRAMD1C, NOTCH2, STK3, F3, DIO2, SLC15A2, ANKRD9, RANBP3L, ANKFN1, IQGAP2, HOPX, PEA15, RHOJ, TRIM5, TRIM5, TRIM5, TRIM5, TRIM5, TRIM5, TRIM5, ATP10B, HGF, LRRC3B, ADHFE1, NPNT, HNMT, CD38, EEPD1, S1PR3, ID4, S1PR1, MT3, EVA1C
HGG-G34R.V_vs_HGG-WT	VIP interneurons	Human ped/adult	Velmeshev et al 2019	0.00580334936163157	0.009378212568396618	-0.42355244881208015	-1.5456751669054678	RELN, VWC2, BTBD11, GABRG3, ASIC2, MTUS2, CNTN4, KCNC2, LINGO2, RP11-123O10.4, PWRN1, ADARB2, GRIK2, DOCK10, GRIK1, GRIP1, KAZN, DNER, CHRM3, SDK1, GALNT13, THSD7A, AP1S2, CACNA1D, VIP
HGG-G34R.V_vs_HGG-WT	MGE-derived Ctx inhibitory neuron, Cortical Plate-enriched	Human fetal	Nowakowski et al 2017	0.004982320797171327	0.008182347975842342	-0.40646911938010866	-1.551621944156754	NXPH1, RPH3A, KCNA3, THRB, SNAP25, PTPRT, MAGI2, NMNAT2, SYT1, FAM135B, CUX2, NTN4, XKR4, CELF4, LINC00599, MAF, CXCR4, SPATS2L, CUX1, RIMS1, TENM2, LPHN3, GRIP1, ST8SIA5, FNBP1, CADPS, SST, TRERF1, VSTM2A, ARID5B, MAPK10, ACKR3, CDK14, BMP3, GNB5, BRINP2
HGG-G34R.V_vs_HGG-WT	VSVZ-2 Endothelial	Mouse adult	Mizrak et al 2019	0.004047927461139896	0.006702306124182451	-0.42177841418998896	-1.5817750937495034	SPOCK2, LTBP4, LY6E, CXCL12, ID3, KANK3, TM4SF1, SLC9A3R2, BSG, IFITM3, FLT1, PODXL, AHNAK, GATA2, FXYD5, ID1, TEK, THBD, SOX18, ABLIM1, PLTP, RAMP2, VWA1, C1orf115, SLCO1A2, SLC2A1, EPAS1, CA4, PTRF
HGG-G34R.V_vs_HGG-WT	Astrocytes 2	Mouse P6	Jessa et al 2019	0.0028749401054144704	0.004839482510781025	-0.41353818274467663	-1.5928402649388969	SCG3, SLC7A10, GSTM5, GRM5, RAMP1, MT-CO3, GLUD2, SERPINE2, CLU, CLDN10, LUZP2, ENHO, CPE, MT-ATP6, CST3, ATP1B1, CBS, GSTM1, MT-CYB, MT-ND4, MT1H, SCD, CD63, MT1G, GABBR1, FEZ1, MMD2, CXCL14, PHGDH, MT1F, APOE, TSC22D4, PMM1, SPARCL1, TSPAN7, MT1A, CD81, PTN, MT-ND1, ID2
HGG-G34R.V_vs_HGG-WT	Ependymal progenitors	Mouse P3	Jessa et al 2019	0.0017543859649122807	0.003003270889087125	-0.41763107144663464	-1.6075248063780252	RARRES2, ENTPD2, HSPA2, NTRK2, TPPP3, C10orf105, PPP1R36, DYNLRB2, ODF3B, RIIAD1, CLU, ITM2C, C9orf24, MEIG1, C2orf50, C7orf57, SIX3, RSPH1, DRC1, MT1H, MT1H, SPAG6, DCDC2, MT1G, MT1G, CYSTM1, C9orf116, DMKN, MT1F, MT1F, TSPAN15, PIFO, NAAA, MT1A, MT1A, NME5, FAM183A, LRRIQ1
HGG-G34R.V_vs_HGG-WT	Str/SVZ 42-Endothelial	Mouse P9	Anderson et al 2020	9.643201542912247e-4	0.0017465184911924746	-0.4369921909233838	-1.6681382189523393	GJB2, A4GALT, PRRX2, CXCL12, CP, CMBL, PTGDS, SIDT1, COL1A1, COL6A1, COL18A1, TMEM132C, LAMA1, SERPINF1, APOD, TGFBR3, LRRK1, ZIC1, NUPR1, WNT4, IER3, SLC1A5, S100A11, GJB6, PRICKLE1, COLEC12, COL12A1, CFH, SERPING1, ITGA8, MICB, ROR2, IL34, ROR1, NR2F2, VAMP5
HGG-G34R.V_vs_HGG-WT	Excitatory neuron intermediate progenitor cells 2	Mouse P0	Jessa et al 2019	9.683666881859264e-4	0.0017465184911924746	-0.44813597468613803	-1.6974100204944427	HECW1, RPRM, CPLX2, TAGLN3, PRMT8, RTN1, EMX1, TBR1, RAB3A, RBFOX3, SSTR2, DUSP4, AUTS2, CNIH3, PPP1R14C, TPRN, CTTNBP2, ITSN1, SCRT2, TESC, PRDM8, LHX2, DPYSL4, BHLHE22, TSPAN4, COL12A1, RCOR2, LRPAP1, PPIB, CYGB, APBA2, MNDA, PROX1
HGG-G34R.V_vs_HGG-WT	Str/SVZ 26-Ependymal	Mouse P9	Anderson et al 2020	0.001160669872326314	0.002056625563244872	-0.46745822152302813	-1.7059010438976645	RARRES2, SLC38A1, TPPP3, DNAH2, RGS22, KIF6, DYNLRB2, ODF3B, SPAG17, RIIAD1, TM4SF1, ITM2C, MEIG1, CCDC30, CHCHD10, RSPH1, WDR63, WWC1, MT1H, MT1G, CCDC170, RSPH10B, DNAH10, PIFO, NME5, ELOF1, LRRIQ1
HGG-G34R.V_vs_HGG-WT	Macrophages	Mouse P6	Jessa et al 2019	6.404098623118795e-4	0.0011967781783495718	-0.44677702248741386	-1.7121658088292953	CCL8, CCL8, OAS1, F13A1, CCL7, CCL2, C19orf38, EHD4, PLD4, IER3, EPSTI1, DDX60, CSF1R, NRROS, LST1, TGFBI, CFH, RAC2, PTAFR, EBI3, TIMD4, AIF1, CD48, MNDA, MNDA, CYTH4, FCGR2A, FCGR2A, MCTP1, LTC4S, ADRB2, SP110, FCGR2B, FCGR2B, C5AR1, CLEC4A, CLEC4A, CLEC4A, CD86, FOLR2, SLFN12L, CCL24, PTPN18, CYBB, SMAGP, TNF, CCL15, CCR1, ALOX5AP, CD53, CD200R1, FCGR1B, LRRC25, STAB1, CCL15-CCL14, CTSS, CXCL2, ANG
HGG-G34R.V_vs_HGG-WT	Meninges	Mouse P6	Jessa et al 2019	3.2107882485150104e-4	6.21184864000492e-4	-0.4577575318816323	-1.75059336600526	IGF2, GPC3, GJB2, MINOS1-NBL1, CXCL12, CP, CMBL, NBL1, S100A10, SIDT1, COL1A1, COL6A1, CPZ, COL6A2, COL18A1, TMEM132C, EFEMP1, OSR1, LAMA1, CRABP2, MMP23B, SERPINF1, APOD, ZIC1, NUPR1, WNT4, FBN2, GJB6, COLEC12, CFH, SERPING1, IL34, ASGR1, VAMP5, GXYLT2, FOXC1, EMILIN1, BMP2, OGN, LPAR1, FCGRT, ENPP1, CLMP, SRPX2, COL13A1
HGG-G34R.V_vs_HGG-WT	Macrophages	Mouse P3	Jessa et al 2019	3.2056419297964416e-4	6.21184864000492e-4	-0.4669004765297875	-1.7933704237547694	P2RY6, CCL8, CCL8, MAF, F13A1, CCL7, CCL2, EHD4, PLD4, DDX60, CSF1R, LST1, CXCR3, TGFBI, RUNX1, RAC2, PTAFR, CD74, AIF1, TNFAIP8L2, CD48, MNDA, FCGR2A, FCGR2A, SPI1, LTC4S, ADRB2, FCGR2B, FCGR2B, PTPN6, C5AR1, PSMB8, CD300A, CLEC4A, CLEC4A, CLEC4A, CD86, FOLR2, LY86, LAPTM5, SLFN12L, RNASE4, CCL24, PTPN18, CD300C, CYBB, TYROBP, FCER1G, EVI2A, CCL15, CCR1, ALOX5AP, CD53, C1QC, CD200R1, FCGR1B, STAB1
HGG-G34R.V_vs_HGG-WT	Macrophages	Mouse P0	Jessa et al 2019	3.2071840923669016e-4	6.21184864000492e-4	-0.472756643802258	-1.8128182257251704	P2RY6, F13A1, CCL7, CCL2, EHD4, PLD4, CSF2RB, EPSTI1, CSF1R, NRROS, LST1, RAC2, UNC93B1, AIF1, TNFAIP8L2, CD48, MNDA, CYTH4, FCGR2A, FCGR2A, LYL1, HLX, SPI1, LTC4S, FERMT3, ADRB2, FCGR2B, FCGR2B, PTPN6, C5AR1, NCF1, PLEK, CD300A, CLEC4A, CLEC4A, CLEC4A, CD86, FOLR2, LY86, LAPTM5, SLFN12L, IRF8, CCL24, PTPN18, CD300C, CYBB, TYROBP, FCER1G, SMAGP, TLR7, EVI2A, CCL15, CCR1, ALOX5AP, CD53, HPGD, C1QC, CD200R1, FCGR1B, LRRC25, STAB1
HGG-G34R.V_vs_HGG-WT	Str/SVZ 25-SPN	Mouse P9	Anderson et al 2020	3.2289312237649337e-4	6.21184864000492e-4	-0.47806575305316623	-1.8144488897497406	PCBP3, FRAS1, TSHZ1, SDK2, EPHA6, CAMK4, PCDH7, FAM155A, MAGI2, CACNA1C, PAK7, KCNC2, ADARB2, ARPP21, CELF4, FGF12, MPPED1, NEGR1, AUTS2, GRIP1, SH3GL2, PPM1L, PPFIA2, PBX3, HCN1, FBN2, CADPS, GRIN2B, KCNB2, LGR5, ADAMTSL1, OTUD7A, ENOX1, ADAMTS19, CDK14, NCAM1, NAV3, BRINP2, CACNA2D1, KCNN2
HGG-G34R.V_vs_HGG-WT	Meninges	Mouse P3	Jessa et al 2019	3.214400514304082e-4	6.21184864000492e-4	-0.48341405932836595	-1.845345259466946	IGF2, AEBP1, GPC3, POSTN, GJB2, MINOS1-NBL1, CXCL12, CP, CMBL, NBL1, S100A10, SIDT1, COL1A1, COL6A1, COL6A2, COL18A1, TMEM132C, EFEMP1, OSR1, CRABP2, MMP23B, SERPINF1, APOD, NUPR1, WNT4, FBN2, SLC1A5, GJB6, COLEC12, COL5A1, CFH, ANGPTL2, WNT6, SERPING1, IL34
HGG-G34R.V_vs_HGG-WT	Str/SVZ 23-Microglia	Mouse P9	Anderson et al 2020	1.6100466913540493e-4	3.722157524654687e-4	-0.49313532481237954	-1.8668367103687917	GAS6, LY6E, SKAP2, P2RY6, CX3CR1, CLTA, ARPC1B, MAF, P2RY12, EFHD2, PYCARD, CSF1R, FAM105A, SDK1, RUNX1, CTSZ, CTSB, CFH, RAC2, VAMP8, COTL1, CTSC, AIF1, SYNGR1, SH3BGRL3, RGS10, DOCK8, PTGS1, MYO1F, PLXDC2, SPI1, LYN, LTC4S, HPGDS, APBB1IP, B2M, FYB, FCGR2B, CD33, LY86, LAPTM5, GRN, RNASE4, SLC9A9, PTPN18, GPX1, TYROBP, DOCK2, FCER1G, ARPC2, SIRPG, IKZF1, MKI67, C1QC
HGG-G34R.V_vs_HGG-WT	VSVZ-1 Endothelial	Mouse adult	Mizrak et al 2019	1.6131634134537829e-4	3.722157524654687e-4	-0.50174907598075	-1.891363586824505	SPOCK2, LTBP4, LY6E, CDKN1A, TSPAN13, CXCL12, PCP4L1, ID3, KANK3, TM4SF1, SLC9A3R2, SLC7A5, BSG, IFITM3, IFITM3, FLT1, PODXL, SPTBN1, SEMA7A, FXYD5, ID1, CAV1, ARL4A, TEK, KLF4, SOX18, ABLIM1, PLTP, CD200, RAMP2, VWA1, TSC22D1, MYL12A, SLCO1A2, SLC2A1, EPAS1, CA4
HGG-G34R.V_vs_HGG-WT	Microglia	Human ped/adult	Velmeshev et al 2019	1.6087516087516087e-4	3.722157524654687e-4	-0.4993608057488658	-1.900500312396217	ABCC4, SYNDIG1, SH3KBP1, ARHGAP22, BLNK, RASGEF1C, HS3ST4, CX3CR1, FOXP2, P2RY12, ABR, BNC2, LRRK1, HIVEP3, ST6GAL1, MTHFD1L, MED13L, CSF1R, MGAT4A, RP11-556E13.1, RP11-480C22.1, ITPR2, RUNX1, MCF2L2, RP11-624C23.1, CD74, MEF2A, MKNK1, TBC1D22A, DOCK8, SLC8A1, MYO1F, SYK, PLXDC2, KCNQ3, NAV3, C3, ADAM28, APBB1IP, FYB, EPB41L2, PTPRC, C10orf11, LY86, FAM49B, CSF2RA, SLC9A9, DIAPH2, ARHGAP26, ETV6, DOCK4, DOCK2, ARHGAP15, PALD1
HGG-G34R.V_vs_HGG-WT	Cortical inhibitory neurons	Mouse P0	Jessa et al 2019	1.6053941242575052e-4	3.722157524654687e-4	-0.49894331901861694	-1.9080993833051645	CELF5, INA, GNAL, GRM5, NNAT, ISLR2, LYPD1, ACTL6B, SYT5, TUBB3, STMN2, GNG3, DPF1, BZW2, SYT1, ZCCHC12, NSG2, APLP1, UCHL1, ZNF503, CELF4, NSG1, STMN3, ELAVL3, KIF26A, FOXP2, RGS17, SYT6, SIX3, CNIH2, BCL11B, PPP3CA, MAP1B, GAP43, ATPIF1, MAPK10, ISL1
HGG-G34R.V_vs_HGG-WT	Meninges	Mouse E15.5	Jessa et al 2019	1.6139444803098772e-4	3.722157524654687e-4	-0.5052991664728904	-1.91392772945596	IGF2, AEBP1, GPC3, GJB2, MINOS1-NBL1, CXCL12, NBL1, S100A10, COL1A1, OAF, COL6A1, ANXA2, COL6A2, ITM2C, RRBP1, OSR1, CDKN1C, SERPINF1, APOD, ZIC1, NUPR1, AHNAK, PPIC, FBN2, S100A11, AKAP12, ARL4A, GJB6, COLEC12, CD63, PLAT
HGG-G34R.V_vs_HGG-WT	Cortical excitatory neurons	Mouse E12.5	Jessa et al 2019	1.6100466913540493e-4	3.722157524654687e-4	-0.5063402830144007	-1.916826032751644	INA, SLC17A6, ISLR2, TAGLN3, RTN1, SYT4, TUBB3, STMN2, TBR1, CBLN2, RAB3A, NSG2, RBFOX3, UCHL1, SSTR2, CELF4, NSG1, STMN3, PRDX2, ELAVL3, NDUFV3, MYT1L, TTC3, BCL11B, BHLHE22, PLXNA4, DPYSL3, NEUROD2, MAP1B, SRRM4, PPP1R14A, KIF21B, COTL1
HGG-G34R.V_vs_HGG-WT	Meninges	Mouse P0	Jessa et al 2019	1.6087516087516087e-4	3.722157524654687e-4	-0.5121737654921287	-1.949264720244112	IGF2, AEBP1, GPC3, POSTN, GSTM5, GJB2, CXCL12, CP, CMBL, S100A10, SIDT1, COL1A1, COL6A1, COL6A2, FOXC2, SPHK1, COL18A1, EFEMP1, OSR1, LAMA1, MMP23B, SERPINF1, APOD, STRA6, LRRK1, NUPR1, WNT4, GSTM1, FBN2, GJB6, COLEC12, COL5A1, CFH, WNT6, RAMP2
HGG-G34R.V_vs_HGG-WT	Str/SVZ 18-Interneurons	Mouse P9	Anderson et al 2020	1.6090104585679806e-4	3.722157524654687e-4	-0.5158890939893218	-1.9663479635777898	CRTAC1, ADCY8, TMEM130, NXPH1, MEGF11, TRHDE, VWC2, NNAT, ERC2, NYAP2, IQSEC3, DLGAP2, OPCML, VSNL1, KCNC2, KIT, RBFOX1, XKR4, CNTNAP3, PCSK6, ZMAT4, ABLIM3, NRCAM, MAF, MYT1L, GRIP1, PPM1L, HCN1, DNER, ADAMTS17, GALNT14, IQSEC1, ADAMTS5, LGR5, LRRTM4, THSD7A, FSTL4, NRTN
HGG-G34R.V_vs_HGG-WT	Oligodendrocyte precursor cells	Mouse P0	Jessa et al 2019	1.6139444803098772e-4	3.722157524654687e-4	-0.5266283772198848	-1.9947166375023238	C1QL1, NXPH1, LHFPL3, RPRM, PCDH11Y, OLIG2, G0S2, OLIG1, CCND1, B3GAT2, KCNIP3, SOX10, SULF2, SERPINE2, PCDH11X, NPTX2, PPP1R16B, KCND2, BRINP3, SAPCD2, CNTN1, RAP1GAP, PPP1R14C, PTPRE, PLLP, XYLT1, ARL4A, RASL11A, NCALD, BCAS1, DUSP26
HGG-G34R.V_vs_HGG-WT	SV2C interneurons	Human ped/adult	Velmeshev et al 2019	1.607200257152041e-4	3.722157524654687e-4	-0.5297039163760716	-2.022048370632281	NXPH1, RELN, RPH3A, PTCHD4, VWC2, GRM5, TMEM132D, SV2C, RAB3C, NYAP2, MTUS2, PTPRT, UNC5D, KCNC2, KIT, SPHKAP, ALK, UNC13C, LINGO2, NRIP3, RP11-123O10.4, ADARB2, GRIK2, ATP8A2, LUZP2, ZMAT4, DOCK10, PTPRM, LINC00693, GRIK1, PRELID2, SPOCK1, FGF13, GRIP1, KAZN, CTC-806A22.1, ANKRD55, FGF14, DNER, BCL11B, AP1S2, GRIN3A, TOX2, NTNG1, GRIN2A
HGG-G34R.V_vs_HGG-WT	Str/SVZ 34-Progenitor	Mouse P9	Anderson et al 2020	1.6100466913540493e-4	3.722157524654687e-4	-0.536006473052979	-2.0291317829873745	CSTB, CX3CR1, CLTA, COX6B1, MINOS1, FTH1, ARPC1B, SDF2L1, MAF, EFHD2, CST3, PYCARD, CSF1R, PPIA, LST1, ACTB, CTSZ, ATP5J2, ATP5J, CTSB, RAC2, VAMP8, COTL1, CD63, MT1G, PABPC1, AIF1, SYNGR1, UQCR10, NPC2, SH3BGRL3, RGS10, APOE, SPI1, CLIC1, LTC4S, B2M, FCGR2B, BOLA2B, ATOX1, LY86, LAPTM5, LIMD2, PTPN18, GPX1, TYROBP, COX6C, FCER1G, ATP5G1, RPL35, UQCRH, EEF1B2, C1QC, TPT1, LGMN, FTL, CTSS, LGALS1, NDUFA2, TOMM7, CFL1, COX8A, CYBA
HGG-G34R.V_vs_HGG-WT	Str/SVZ 9-Microglia	Mouse P9	Anderson et al 2020	1.6113438607798906e-4	3.722157524654687e-4	-0.5391896348886495	-2.0316337232367463	LY6E, P2RY6, BIN1, CX3CR1, CLTA, ARPC1B, ITGB5, MAF, P2RY12, CST3, PYCARD, CSF1R, LST1, FAM105A, RUNX1, CTSZ, CTSB, CFH, RAC2, UNC93B1, COTL1, PIP4K2A, AIF1, ITM2B, NPC2, SH3BGRL3, RGS10, DOCK8, PTGS1, CYTH4, MYO1F, APOE, PLXDC2, SPI1, LYN, LTC4S, HPGDS, FERMT3, APBB1IP, B2M, FYB, FCGR2B, CD33, CD33, LPCAT2, LY86, LAPTM5, RNASE4, SLC9A9, PTPN18, TYROBP, DOCK2, FCER1G, ZNF710, SIRPG, IKZF1, ZFHX3, C1QC, SLCO2B1, LGMN, CTSS, CRYBB1, SERINC3, TGFBR1
HGG-G34R.V_vs_HGG-WT	VSVZ-2 OPC	Mouse adult	Mizrak et al 2019	1.6139444803098772e-4	3.722157524654687e-4	-0.5367364978952764	-2.03300328774234	C1QL1, NXPH1, RPRM, OLIG2, G0S2, OLIG1, RAMP1, CCND1, LIMS2, KCNIP3, GPR17, GNG3, SOX10, SULF2, SERPINE2, TNR, PHLDA1, NEU4, STMN3, CNTN1, LUZP2, S100B, KANK1, SNX22, BRINP1, MIDN, SNX1, MATN4, PLLP, ZDHHC2, LBH, XYLT1, ITPR2, TCEAL3, VCAN, CHADL, NCALD
HGG-G34R.V_vs_HGG-WT	Cortical inhibitory neurons	Mouse E12.5	Jessa et al 2019	1.6144656118824668e-4	3.722157524654687e-4	-0.5466564861087368	-2.0546253117868893	INA, L1CAM, NNAT, ISLR2, LY6H, RAB3C, TAGLN3, NEFM, RTN1, TSHZ2, ACTL6B, TUBB3, STMN2, GNG3, RAB3A, SYT1, APLP1, CELF3, UCHL1, BEX2, POU3F1, CELF4, NSG1, STMN3, ELAVL3, TUBB4A, SIX3, TTC3, CNIH2, DPYSL3, CD200, VCAN, MAP1B, GAP43, ATPIF1, PGRMC1, ISL1
HGG-G34R.V_vs_HGG-WT	Meninges	Mouse E12.5	Jessa et al 2019	1.6118633139909736e-4	3.722157524654687e-4	-0.5486209583687022	-2.0729146268689966	IGF2, AEBP1, GPC3, PRRX2, MINOS1-NBL1, CXCL12, ALCAM, FAM174B, NBL1, DKK2, S100A10, COL1A1, OAF, SIX2, COL6A1, ANXA2, COL6A2, RRBP1, OSR1, CDKN1C, SERPINF1, APOD, NUPR1, AHNAK, PPIC, FBN2, S100A11, AKAP12, COLEC12, CD63, RAMP2, RBMS1
HGG-G34R.V_vs_HGG-WT	VSVZ-2 COP	Mouse adult	Mizrak et al 2019	1.6139444803098772e-4	3.722157524654687e-4	-0.5473052964464472	-2.0730348531124463	KNDC1, RAB33A, SEMA3D, OLIG2, KIAA1644, OLIG1, COL9A3, LIMS2, PCDH7, GPR17, NFASC, SOX10, PLXNB3, UST, SULF2, TNR, NEU4, DDC, TMEFF2, CNTN1, TCF7L2, LUZP2, TSPAN2, KANK1, SIRT2, SLC1A1, TUBB4A, ELOVL6, ELOVL7, PLLP, GSTO1, DYNLL2, CHADL, BCAS1, GAL3ST1, MICAL3, CNP, MYRF, TNS3, BACE1
HGG-G34R.V_vs_HGG-WT	Cortical inhibitory neurons	Mouse E15.5	Jessa et al 2019	1.6118633139909736e-4	3.722157524654687e-4	-0.5518945480938918	-2.08528358930144	INA, SHANK1, NNAT, ISLR2, LY6H, NEFM, RTN1, TSHZ2, ACTL6B, SYT5, TUBB3, STMN2, GNG3, TSPAN13, ZCCHC12, APLP1, RBFOX1, FAM57B, UCHL1, POU3F1, ZNF503, CELF4, NSG1, STMN3, ELAVL3, FOXP2, CNIH2, INPP5F, BCL11B, THSD7A, DPYSL3, AP1S2, SYBU, VSTM2A, TLE4, CD200, VCAN, MAP1B, GAP43, ATPIF1, PGRMC1, ISL1
HGG-G34R.V_vs_HGG-WT	VSVZ-2 T	Mouse adult	Mizrak et al 2019	1.650709805216243e-4	3.746554838805406e-4	-0.5734834025740108	-2.1013449573971688	LY6E, S100A10, CD8B, ANXA2, RPLP1, TSPO, ARPC1B, NKG7, PLAC8, CD3G, SELL, CD79A, AHNAK, CORO1A, FXYD5, S100A11, ITGB7, HMHA1, SHISA5, RAC2, IL2RG, LTB, PABPC1, CD74, NAPSA, DUSP2, CNN2, MNDA, S100A4, GPSM3, HLA-DRB1, ITGB2, GIMAP1, B2M, PTPN6, HLA-DQB1, PSMB8, PTPRC, HLA-DQA1, CD3D, TMSB10, PYHIN1, TAGLN2, PTPN18
HGG-G34R.V_vs_HGG-WT	Oligodendrocyte precursor cells	Human ped/adult	Velmeshev et al 2019	1.6090104585679806e-4	3.722157524654687e-4	-0.5546168684628643	-2.1139616296878287	NXPH1, MEGF11, LHFPL3, CNTNAP5, OLIG1, CSMD3, CA10, NOVA1-AS1, PTPRT, AGAP1, OPCML, DPP6, SULF2, TNR, COL9A1, KCND2, MMP16, BRINP3, ADARB2, PLEKHH2, DCC, GRIK2, ZFPM2, FGF12, LUZP2, APOD, GRIK1, LPHN3, KAZN, FGF14, XYLT1, GALNT13, LRRTM4, VCAN
HGG-G34R.V_vs_HGG-WT	Cortical excitatory neurons 2	Mouse P0	Jessa et al 2019	1.6144656118824668e-4	3.722157524654687e-4	-0.5609970497903385	-2.1292060090984135	EDIL3, ISLR2, LY6H, TAGLN3, RTN1, SYT4, ACTL6B, TUBB3, STMN2, RNF182, CAMK2B, RAB3A, OPCML, SH3KBP1, NSG2, APLP1, RBFOX1, UCHL1, NSG1, STMN3, ELAVL3, GRP, CNIH3, CCK, CTTNBP2, ITSN1, SEPT3, TTC3, CNIH2, CNTN2, PCDH8, SNCA, BHLHE22, DPYSL3, KCTD4, NEUROD2, MAP1B, GAP43
HGG-G34R.V_vs_HGG-WT	Early and Late Born Excitatory Neuron PFC	Human fetal	Nowakowski et al 2017	1.607200257152041e-4	3.722157524654687e-4	-0.5593460162110029	-2.1352016961417504	GNAL, L1CAM, KIAA1644, NEFM, ACTL6B, NCDN, VSTM2L, SYT1, PRKG2, APLP1, RBFOX1, SRM, MPPED1, ATP8A2, R3HDM1, GPR85, SATB2, DUSP4, SLCO3A1, SPOCK1, LPHN3, PPP1R14C, ADRA2A, PKIA, DISP2, HOMER1, LNX1, PRDM8, CPNE8, MSL3, MSL3, AKR1C2, AKR1C2, AKR1C2, AKR1C2, AKR1C2, AKR1C2, AKR1C2, AKR1C2, AKR1C2, GAP43, SLC35F2, SLC44A5, HS6ST3, FLRT2, CLVS1, CACNA2D1, ACTR3, DNAH10
HGG-G34R.V_vs_HGG-WT	VSVZ-2 Oligodendrocytes	Mouse adult	Mizrak et al 2019	1.6144656118824668e-4	3.722157524654687e-4	-0.5636126279667607	-2.1391331642814686	SEZ6L2, EDIL3, OLIG1, TPPP3, APP, EFNB3, PTGDS, PPP1R16B, MAL, BIN1, APLP1, NDRG1, TMEFF2, TPPP, TNFAIP6, FTH1, SEC11C, TSPAN2, APOD, DESI1, TUBB4A, TMEM151A, FA2H, ELOVL7, CMTM5, CSRP1, YWHAQ, MAPK8IP1, PLLP, CNTN2, SERPINB1, PEX5L, QDPR, SCD, PPP1R14A, CDC42EP2, DUSP26, PLEKHB1, JOSD2, LGI3, GPR37, FEZ1, CNP, RHOG
HGG-G34R.V_vs_HGG-WT	Astro-ependymal progenitors	Mouse P0	Jessa et al 2019	1.6087516087516087e-4	3.722157524654687e-4	-0.5666479674519216	-2.1565862333670034	ENTPD2, MEGF11, GSTM5, HSPA2, RAMP1, RSPO3, NTRK2, TPPP3, METRN, FBXO2, C10orf105, MIA-RAB4B, DYNLRB2, RIIAD1, GDPD2, CLU, TCF7L2, ITM2C, GDF10, ZIC4, MEIG1, C2orf50, C7orf57, ZIC1, SIX3, CST3, CMTM5, RSPH1, GSTM1, SLC39A12, BCL2, PTCH1, DCDC2, IGFBP5, CD63, ITM2B, PRELP, PHGDH, C9orf116, FAM213A, APOE, TSPAN15, MGST1, PIFO, NAAA, NME5, FAM183A, CD81, PTN
HGG-G34R.V_vs_HGG-WT	VSVZ-1 Microglia	Mouse adult	Mizrak et al 2019	1.6144656118824668e-4	3.722157524654687e-4	-0.5723162142807307	-2.1721667217437357	LY6E, SUSD3, CTSH, CX3CR1, SOCS3, CCL18, CCL4, ITGB5, MAF, P2RY12, CST3, PLD4, GOLM1, PYCARD, CSF1R, LST1, FAM105A, HEXB, JUNB, HSPA1B, SELPLG, CTSZ, JUN, TMEM119, P2RY13, UNC93B1, AIF1, BIN2, RGS10, PTGS1, CYTH4, SPI1, LTC4S, HPGDS, EGR1, ADRB2, APBB1IP, B2M, FCGR2B, CD33, LPCAT2, ITGAM, LY86, LAPTM5, ATF3, SLC2A5, GRN, ZFP36, RNASE4, IRF8, ARSB, PTPN18, TYROBP, BCL2A1, FCER1G, ALOX5AP, CD53, HPGD, TMEM173, C1QC, SLCO2B1, CTSD, IER5, MAFB, LGMN, CCL15-CCL14, CTSS, CRYBB1, SERINC3, TGFBR1, DUSP6, ABI3
HGG-G34R.V_vs_HGG-WT	Str/SVZ 15-OPCs	Mouse P9	Anderson et al 2020	1.6100466913540493e-4	3.722157524654687e-4	-0.5742624357055248	-2.173955387942955	SEMA3D, IGSF9B, TMEM132D, CDH20, COL9A3, LIMS2, PCDH7, NCAM2, GPR17, NFASC, SOX10, OPCML, UST, SULF2, PPP1R16B, TNR, NKX2-2, CSGALNACT1, BRINP3, NEU4, TMEFF2, TCF7L2, CDH13, DNM3, S100B, KANK1, SIRT2, ZDHHC14, SLC1A1, KAZN, TUBB4A, FA2H, ELOVL7, PRKCQ, PTPRE, FBN2, PLLP, DYNLL2, PPFIBP1, RAPGEF1, ITPR2, NCALD, BCAS1
HGG-G34R.V_vs_HGG-WT	Microglia	Mouse E12.5	Jessa et al 2019	1.5827793605571383e-4	3.722157524654687e-4	-0.5596764214827374	-2.1752622990567807	GAS6, CCL3L3, CCL3, CRYBA4, CX3CR1, CLTA, CCL18, CCL4, ARPC1B, MAF, F13A1, CCL2, EHD4, CST3, PLD4, LAMP1, CORO1A, CSF1R, NRROS, LST1, MT1H, CTSZ, CTSB, CFH, RAC2, UNC93B1, VAMP8, MT1G, CTSC, AIF1, BIN2, ITM2B, CYTH4, FCGR2A, MYO1F, MT1F, APOE, SPI1, HPGDS, FERMT3, ADRB2, MT1A, B2M, FCGR2B, PTPN6, C5AR1, PSMB8, PLEK, PTPRC, FCGRT, CD86, LY86, LAPTM5, ATF3, GRN, PLIN2, RNASE4, CCL24, PTPN18, TYROBP, FCER1G, SMAGP, NCF2, CD53, C1QC, FCGR1B, TGFB1, STAB1, CTSD, LGMN, FTL, CTSS
HGG-G34R.V_vs_HGG-WT	Microglia	Mouse E15.5	Jessa et al 2019	1.6028209648982208e-4	3.722157524654687e-4	-0.5678020573464503	-2.18093462606965	GAS6, SIRPB1, P2RY6, DHRS3, CTSH, SIRPA, CX3CR1, CLTA, ARPC1B, GUSB, P2RY12, EHD4, CST3, PLD4, LAMP1, CORO1A, PYCARD, CSF1R, LST1, FAM105A, HEXB, CTSZ, PSAP, CTSB, RAC2, UNC93B1, VAMP8, CD63, CTSC, CTSV, AIF1, BIN2, ITM2B, SH3BGRL3, RGS10, CD48, CYTH4, FCGR2A, APOE, SPI1, LYN, LTC4S, HPGDS, B2M, FCGR2B, PSMB8, CD300A, FCGRT, CD86, LY86, LAPTM5, GRN, PLIN2, RNASE4, CREG1, PTPN18, CD300C, TYROBP, FCER1G, EVI2A, SIRPG, CD53, C1QC, FCGR1B, CTSD, BST2, LGMN, FTL, CTSS, CRYBB1
HGG-G34R.V_vs_HGG-WT	VSVZ-2 Microglia	Mouse adult	Mizrak et al 2019	1.6144656118824668e-4	3.722157524654687e-4	-0.5787956936598085	-2.1988364174054817	LY6E, SUSD3, CTSH, CX3CR1, SOCS3, CCL18, CCL4, ITGB5, MAF, P2RY12, CST3, PLD4, GOLM1, PYCARD, CSF1R, FAM105A, HEXB, JUNB, SELPLG, CTSZ, JUN, CFH, TMEM119, P2RY13, UNC93B1, CTSC, AIF1, BIN2, RGS10, PTGS1, CYTH4, SPI1, LYN, LTC4S, HPGDS, APBB1IP, B2M, FCGR2B, CD33, LPCAT2, NCF1, IL6R, ITGAM, LY86, LAPTM5, ATF3, SLC2A5, GRN, ZFP36, RNASE4, IRF8, ARSB, PTPN18, TYROBP, BCL2A1, FCER1G, SPARC, NCKAP1L, ALOX5AP, CD53, HPGD, TMEM173, C1QC, SLCO2B1, CTSD, IER5, MAFB, LGMN, CTSS, CRYBB1, SERINC3, TGFBR1, DUSP6, ABI3, CCR2, LAIR1
HGG-G34R.V_vs_HGG-WT	VSVZ-1 T	Mouse adult	Mizrak et al 2019	1.6215339711366953e-4	3.722157524654687e-4	-0.5898065175506259	-2.2035186781406257	LCK, MYO1G, LGALS3, CD8B, NKG7, PLAC8, CD44, CXCR4, CD3G, SELL, CCR7, CD79A, CD69, CD2, IFITM1, RNASE2, LAT, EPSTI1, CORO1A, FXYD5, ITGAL, S1PR4, ITGB7, HCST, SPN, SHISA5, RAC2, IL2RG, FCRLA, CD74, PLBD1, NAPSA, DUSP2, MNDA, MNDA, S100A4, MS4A1, SAMHD1, HLA-DRB1, GIMAP1, B2M, HLA-DQB1, IGLL1, PTPRC, HLA-DQA1, CLEC4A, CLEC4A, CD3D, PTPN18, GIMAP4, CYBB, HLA-DOB, CRIP1, ARHGAP15, RNASE6, CD3E, SIRPG, SIRPG
HGG-G34R.V_vs_HGG-WT	Newborn Excitatory Neuron - early born 1	Human fetal	Nowakowski et al 2017	1.607200257152041e-4	3.722157524654687e-4	-0.5810927005874874	-2.2182157089717136	NPTX1, HECW1, TMEM130, MYT1, JPH4, NKAIN1, C3orf14, PHYHIP, ISLR2, EPB41L3, ERC2, SYT4, SLC17A7, TBR1, SYT1, SLC6A15, KIT, RBFOX3, DHCR24, PGBD5, DCC, ADARB1, ZFPM2, RCAN3, PLBD2, DHCR7, AUTS2, MESDC1, TMEM189, SLC24A2, GLB1L2, WNK2, ABRACL, BCL11B, CFTR, CNTN2, PRDM8, B3GAT1, TXNL4A, THSD7A, NEO1, C1orf115, EPHA7, FSCN1
HGG-G34R.V_vs_HGG-WT	Str/SVZ 39-Microglia	Mouse P9	Anderson et al 2020	1.6131634134537829e-4	3.722157524654687e-4	-0.5888187501838327	-2.2195762715862832	KCNK13, SUSD3, P2RY6, BLNK, CX3CR1, ARPC1B, ITGB5, MAF, P2RY12, PLD4, CSF1R, LST1, FAM105A, RUNX1, SELPLG, GNA15, CFH, TMEM119, RAC2, UNC93B1, CTSC, AIF1, VAV1, DOCK8, PTGS1, CYTH4, IL1RL2, MYO1F, SPI1, LYN, LTC4S, HPGDS, FERMT3, APBB1IP, B2M, FYB, FCGR2B, FCGR2B, PIK3AP1, CD33, CD33, ARHGAP30, LPCAT2, NCF1, IL6R, PTPRC, RHOH, CD86, LY86, LAPTM5, RNASE4, PTPN18, TYROBP, DOCK2, FCER1G, TNFRSF13B, IKZF1, NCKAP1L, CD53, C1QC, SLCO2B1
HGG-G34R.V_vs_HGG-WT	Cortical excitatory neurons 1	Mouse P0	Jessa et al 2019	1.6144656118824668e-4	3.722157524654687e-4	-0.5852631039574556	-2.2213052961963458	LY6H, FAM49A, RTN1, SYT4, NBEA, KIAA1549L, TUBB3, STMN2, GNG3, TSPAN13, RAB3A, OPCML, BZW2, NSG2, APLP1, RBFOX1, MIF, UCHL1, ARPP21, POU3F1, NSG1, STMN3, MPPED1, GPR85, ELAVL3, SATB2, CCK, TENM2, MYT1L, PPFIA2, TTC3, CNIH2, ABRACL, SERP2, CNTN2, PTMA, BHLHE22, PLXNA4, DPYSL3, NEUROD2, FAM19A2, MAP1B, TSC22D1, ATPIF1, CLSTN2, JAKMIP1, NEUROD6, TUBB2B, NCAM1
HGG-G34R.V_vs_HGG-WT	Microglia	Human fetal	Nowakowski et al 2017	1.607200257152041e-4	3.722157524654687e-4	-0.583126265490566	-2.225978473172093	CCL3, BLNK, CX3CR1, LAT2, CCL4, P2RY12, IL1B, CD69, C10orf54, HMOX1, CSF1R, CSF1, CCL5, SELPLG, DHRS9, CH25H, P2RY13, PTAFR, CD74, BIN2, RGS10, DOCK8, PTGS1, CYTH4, TAGAP, TAGAP, TAGAP, TAGAP, FCGR2A, FCGR2A, BHLHE41, C3, ADAM28, ITGB2, ITGB2, HPGDS, NCF4, APBB1IP, FYB, TLR4, C5AR1, ARHGAP25, PLEK, IL6R, PTPRC, ITGAM, FOLR2, LY86, NLRP3, LAPTM5, IRF8, CSF3R, RHBDF2, CSF2RA, ITGAX, SPP1, CYBB, TYROBP, HAVCR2, BCL2A1, BCL2A1, BCL2A1, BCL2A1, CD4, FCER1G, TLR7, FPR1, NCKAP1L, CD53, C1QC, TMEM52B, RGS1, STAB1
