Comparison	Cell_type	Age	Dataset	pval	padj	ES	NES	leadingEdge
HGG-G34R.V_vs_HGG-H3.3-K27M-thalamic	Early and Late Born Excitatory Neuron V1	Human fetal	Nowakowski et al 2017	2.51004016064257e-4	5.727133286268773e-4	-0.499814665950268	-1.9939979129453251	RNF182, FGF12, KHDRBS2, GPR85, ARPP21, LINGO1, NCALD, PKIA, KIAA1244, TENM2, STK32B, TSPAN13, SERPINE2, NEFM, GUCY1A2, FAM49A, STMN4, SYT4, FAM19A1, CNRIP1, TDRD7, SLC8A1, NDST3, RUNX1T1, STMN2, FAXC, CAMKV, DAB1, AKAP7, SLC44A5, ATP6V1G2, CHD5, GRIN2B, GAP43, SEMA3A, PLXNA4, WWC1, B3GALT1, GABRB2, SHISA9, CAMK2B, ADRA2A, GPR27, SCUBE1, PRSS12, NCDN, TBC1D30, CDKL5, SNCA, ABLIM1, VLDLR, MCUR1, PCLO
HGG-G34R.V_vs_HGG-H3.3-K27M-thalamic	Str/SVZ 41-Interneurons	Mouse P9	Anderson et al 2020	2.461841457410143e-4	5.727133286268773e-4	-0.505369672469909	-1.9946908921317208	SCN9A, SLC6A15, KCNK9, CA10, PPAPDC1A, GDNF, FGF12, CGREF1, HCN4, FIGN, CACNA2D2, SPHKAP, NRIP3, SV2C, FAM155A, SYT13, TRPC4, VSTM2L, LIN28B, LRP1B, ZMAT4, SYT1, NYAP2, ZIC1, DSCAM, KCNT2, ELFN1, ASIC2, ACHE, CFTR, TACR3, ADAMTS17, SLC5A7, SLC17A8, GARNL3, TSHZ2, RESP18, TRPC3, CLSTN2, SLC7A14
HGG-G34R.V_vs_HGG-H3.3-K27M-thalamic	Cortical excitatory neurons 1	Mouse P0	Jessa et al 2019	2.4648755237860487e-4	5.727133286268773e-4	-0.5063552074966513	-2.01212014689038	BZW2, LY6H, POU3F1, FAM19A2, KHDRBS2, OPCML, GPR85, ARPP21, RTN1, TENM2, TSPAN13, FAM49A, STMN4, NSG2, SYT4, PPFIA2, CNIH2, KIAA1549L, NBEA, TUBB3, UCHL1, RUNX1T1, STMN2, TSC22D1, RBFOX1, TUBB2B, DAB1, MARCKSL1, PTMA, ELAVL3, GPM6A, SERP2, NME1, TTC3, GNG3, CLMP, ID2, RAB3A, PLXNA4, CLSTN2, NCAM1
HGG-G34R.V_vs_HGG-H3.3-K27M-thalamic	VSVZ-2 Oligodendrocytes	Mouse adult	Mizrak et al 2019	2.4648755237860487e-4	5.727133286268773e-4	-0.5108980431905307	-2.030172160750093	EFNB3, UGT8, OLIG1, ENPP2, TPPP3, TMEFF2, PLLP, TMEM88B, STMN4, CMTM5, NDRG1, PLEKHB1, MAPK8IP1, APOD, JOSD2, MBP, PLS1, DUSP26, YWHAQ, DEGS1, MOBP, TNFAIP6, TSPAN2, SEZ6L2, PDLIM2, CLDN11, PPP1R16B, EDIL3, APP, TTLL7, SLC44A1, PTPRD, BIN1, MOG, TUBB4A, TPPP, TALDO1, GJB1, GJC3, OPALIN, FA2H, LPAR1, EVI2A, NKX6-2, CNP, MAG, SEC11C, HAPLN2, DESI1, TF, SYT11, CNTN2
HGG-G34R.V_vs_HGG-H3.3-K27M-thalamic	Str/SVZ 27-SPN	Mouse P9	Anderson et al 2020	2.4648755237860487e-4	5.727133286268773e-4	-0.5146863631401762	-2.0452259308717307	CNTNAP5, CELF5, GNAL, POU3F1, MME, CNTN4, KCTD16, ARPP21, SV2C, PPP1R1B, CAMK4, FAM135B, GALNT13, RGS9, NGEF, SYNDIG1, PENK, ANO3, SYNDIG1L, ATP2B1, SGCZ, CHRM3, PPP3CA, PHYHIP, HPCA, RXRG, PCP4L1, PDE10A, GABRG3, KCNA4, NETO1, CALN1, ZNF804A, BCL11B, PTPN5, RGS7BP, KCNAB1, NEBL, CAMK2B, EPHA7, GALNT8, KCTD8, CDH8, ADCY5, INHBA, GPRIN3, EGR1, GUCY1B3
HGG-G34R.V_vs_HGG-H3.3-K27M-thalamic	Str/SVZ 2-Progenitor	Mouse P9	Anderson et al 2020	2.4919013207077e-4	5.727133286268773e-4	-0.5173414406833929	-2.045297604647136	TTC9B, COL19A1, HPCAL4, PSD, CPE, DDN, SPTBN2, PTN, CNIH2, CST3, CALM3, DBI, NDUFA4, PCP4L1, NDUFC1, SEPW1, SERP2, NDUFV3, NDUFA5, ATP5J, ARF3, HSBP1, PPP1R1A, YBX1, SLC26A8, COX6C, SRPK1, UQCRH, NDUFA7, CPLX2, COX7A2, RASL10B, ATPIF1, YWHAG, CALM1, UBL5, MT3, PURB, KIF1A
HGG-G34R.V_vs_HGG-H3.3-K27M-thalamic	Str/SVZ 6-SPN	Mouse P9	Anderson et al 2020	2.4962556165751375e-4	5.727133286268773e-4	-0.5179685682127066	-2.0522823203325204	CNTNAP5, GRM5, LYPD1, SCN2A, GNAL, KCTD16, ARPP21, PPP1R1B, CAMK4, NDRG4, LRFN5, PRKACB, RGS9, RELN, NGEF, ATP2B2, ANO3, SYT4, ATP2B1, PPP3CA, RXRG, PCP4L1, RBFOX1, PRKCE, PDE10A, KCNQ5, CALM2, ELMOD1, NETO1, CALN1, DLGAP2, BCL11B, RGS7BP, GRIN2B, YWHAZ, KCNAB1, SNAP25, CNTNAP2, CAMK2B, PTPRD, GALNT8, KCTD8, CALB1, CDH8, ADCY5
HGG-G34R.V_vs_HGG-H3.3-K27M-thalamic	Early Born Deep Layer/subplate Excitatory Neuron V1	Human fetal	Nowakowski et al 2017	2.51004016064257e-4	5.727133286268773e-4	-0.5154378926613796	-2.056326379030248	KIT, GABBR2, GRM5, RALYL, NTRK2, ZFPM2, CNTN1, SCN2A, IGSF21, GABRA3, KHDRBS3, OPCML, PAPPA2, LRRTM4, AGAP1, KIAA1644, NLGN1, VSTM2L, SYT6, SYT16, SH3GL2, GLB1L2, KAZN, KCNMA1, NPTX1, TLE4, GPD1L, DPP10, DAB1, SOX5, WASF1, B3GAT1, ELMOD1, SULT4A1, VSNL1, GRIK3, GRIN2B, PDZD2, KLHL1, CLSTN2
HGG-G34R.V_vs_HGG-H3.3-K27M-thalamic	NRGN-expressing neurons 2	Human ped/adult	Velmeshev et al 2019	2.5031289111389235e-4	5.727133286268773e-4	-0.5290664255613636	-2.1083189662794823	SCN2A, RTN1, NDRG4, FAIM2, CADM3, ATP2B2, NSG2, SYT4, SYT1, ATP2B1, CALM3, OCIAD1, BEX2, UCHL1, LINC00657, PREPL, NSF, STMN2, PRKAR1B, PLD3, STXBP1, SEPW1, CLSTN1, SCN3B, VSNL1, SEZ6L2, YWHAB, RAB3A, PPIA, YWHAZ, PRNP, GAP43, CAMK2A, ATP6V1A, SNAP25, SCG5, APP, TMEM66, ATP1B1, PCSK1N, DNM1, RGS4, YWHAG, SERINC1, CALM1, CCK, SNCA, TUBB2A, ATP1A3
HGG-G34R.V_vs_HGG-H3.3-K27M-thalamic	SV2C interneurons	Human ped/adult	Velmeshev et al 2019	2.51004016064257e-4	5.727133286268773e-4	-0.529693613141922	-2.1131992137472704	NXPH1, KIT, GRM5, GRIA4, LUZP2, ADARB2, FSTL5, NTNG1, VWC2, ANKRD55, RAB3C, SGK1, SPHKAP, DOCK10, NRIP3, SV2C, LINC00693, FGF14, PTPRT, SCN1A, RP11-123O10.4, RELN, DNER, ZMAT4, UNC13C, GRIK2, CDK14, GRIP1, NYAP2, PTPRM, SGCZ, KAZN, ATP8A2, TMEM132D, TOX2, KCNIP1, RPH3A, PRELID2, GRIK1, DAB1, CACNA2D1, FGF13
HGG-G34R.V_vs_HGG-H3.3-K27M-thalamic	Somatostatin interneurons	Human ped/adult	Velmeshev et al 2019	2.4271844660194174e-4	5.727133286268773e-4	-0.5406040711752375	-2.127712313672958	NXPH1, LHFPL3, RALYL, CDH12, FSTL5, PCDH11Y, EPHA6, TRHDE, RAB3C, PCDH11X, LINC00693, TENM2, RP11-123O10.4, RP11-85M11.2, UNC13C, GRIK2, GRIP1, PTPRM, ASTN2, XKR4, CHRM3, SLC8A1, KCNIP1, GRID2, RUNX1T1, PCDH15, RBFOX1, GRIK1, DAB1, BACH1, NETO1, OXR1, SOX6, MTUS2, GRIK3, KCNC2, WLS, CADPS, CNTNAP2, COL25A1, TIAM1, CDH8, SHISA6, TENM3
HGG-G34R.V_vs_HGG-H3.3-K27M-thalamic	Early and Late Born Excitatory Neuron PFC	Human fetal	Nowakowski et al 2017	2.51004016064257e-4	5.727133286268773e-4	-0.5360145002906543	-2.13841623245674	RPRM, GRM5, RALYL, FSTL5, PCDH11Y, GNAL, GABRA3, FGF12, CNTN4, LPHN3, ARPP21, STK32B, MB21D2, FGF14, VSTM2L, FAM49A, SYNDIG1, RUNDC3B, PCDH10, SYT4, NDRG1, PCDH17, ATP8A2, SLC8A1, NDST3, STMN2, SLITRK5, CDKN2D, CNTN3, CBLN2, DAB1, CACNA2D1, KCNQ5, ELMOD1, CALN1, PPP1R14C, GRIN2B, GAP43, KIAA1045, RCAN1, ADRA2A, CPNE8, RSPO3, SCUBE1, CXXC4, MPPED1, NCDN, GPRIN3, TBC1D30
HGG-G34R.V_vs_HGG-H3.3-K27M-thalamic	Str/SVZ 14-SPN	Mouse P9	Anderson et al 2020	2.4919013207077e-4	5.727133286268773e-4	-0.5419595808640636	-2.1426248612378322	CNTNAP5, DGKI, GRM5, CSMD3, LYPD1, RAMP1, NEGR1, CNTN4, KHDRBS2, KCTD16, DPP6, THRB, TENM2, SERPINE2, BRINP1, FGF14, SLC2A13, GALNT13, LRFN5, CACNA1E, RELN, ANO3, GRIK2, ATP2B1, KCNMA1, CDH18, RBFOX1, CNTN3, PDE10A, GABRG3, GABRB3, KCNQ5, ELMOD1, NETO1, CALN1, STXBP5L, ZNF804A, DLGAP2, DGKB, GRIN2B, KCNAB1
HGG-G34R.V_vs_HGG-H3.3-K27M-thalamic	Str/SVZ 36-Interneurons	Mouse P9	Anderson et al 2020	2.49003984063745e-4	5.727133286268773e-4	-0.5434885749572762	-2.159901154206369	NXPH1, SCN9A, ZNF804B, VGF, LY6H, FSTL5, SYNGR3, IGSF21, CGREF1, OPCML, CHODL, KCNB2, FAM155A, SYT13, DGKG, GRIK4, PTPRT, TMEM130, VSTM2B, ZMAT4, SFRP1, MASP1, ARHGDIG, KCNMB2, NYAP2, PTPRM, RIMS4, XKR4, CHRM3, GALR1, ACHE, GRIK1, CBLN2, DPP10, NOS1, SLC44A5, CNTNAP3, SOX6, VSNL1, NPY2R, KCNC2, RYR2, RESP18, TRPC3, FXYD6
HGG-G34R.V_vs_HGG-H3.3-K27M-thalamic	Cortical excitatory neurons 2	Mouse E15.5	Jessa et al 2019	2.5031289111389235e-4	5.727133286268773e-4	-0.5425116759632211	-2.161898016204141	BZW2, HECW1, LY6H, GPR85, ARPP21, RTN1, TAGLN3, NNAT, TSPAN13, INA, REEP1, DNER, STMN4, CD200, NSG2, SYT4, CNIH2, BEX2, ACTL6B, SNCB, TUBB3, UCHL1, STMN2, TUBB2B, PCDH9, ELAVL3, GPM6A, SERP2, KIFAP3, PPP1R14C, GNG3, RAB3A, FXYD6-FXYD2, GAP43, PLXNA4, FXYD6, NCAM1, APP, FAM84A, GNG2, CNTNAP2, EPHA7, PTPRD, CELF4, PAFAH1B3, PCSK1N, GRIA2, STMN3, ATPIF1, NR2F2
HGG-G34R.V_vs_HGG-H3.3-K27M-thalamic	Astro-ependymal progenitors	Mouse P0	Jessa et al 2019	2.4962556165751375e-4	5.727133286268773e-4	-0.5523002822587225	-2.197276348679604	MEGF11, NTRK2, METRN, DYNLRB2, ITM2C, RAMP1, CAPSL, TCF7L2, GDPD2, RSPH1, TPPP3, C2orf50, GSTM5, SIX3, PTCH1, LRP1B, RIIAD1, FBXO2, C10orf105, CMTM5, SLC39A12, PTN, ZIC3, CST3, ZIC1, DBI, BCL2, NKAIN4, MEIG1, FAM183A, ENTPD2, MIA, NME5, APOE, OTX2, DCDC2, PIFO, ZIC4, CLU, FHL1, GSTM1, C7orf57, CD81, PACRG, MLF1, RSPO3
HGG-G34R.V_vs_HGG-H3.3-K27M-thalamic	Str/SVZ 38-SPN	Mouse P9	Anderson et al 2020	2.4962556165751375e-4	5.727133286268773e-4	-0.5600766150639158	-2.2191217878211775	CNTNAP5, CNTNAP5, GRM5, KCND2, CSMD3, ZNF804B, CDH12, EPHA6, POU6F2, CNTN4, KCTD16, LRRTM4, TENM2, DGKG, FGF14, GALNT13, LRFN5, LRP1B, RELN, PTPRN2, ANO3, SYT1, ERC2, SGCZ, XKR4, CHRM3, CDH18, RBFOX1, CNTN3, OLFM3, PDE10A, GABRG3, GABRB3, KCNQ5, FRAS1, NETO1, PIFO, ZNF804A, DLGAP2, GRIN2B, KCNAB1, CNTNAP2, EPHA7, COL25A1, PTPRD, GALNT8, KCNIP4, KCTD8, CDH8
HGG-G34R.V_vs_HGG-H3.3-K27M-thalamic	Early Born Deep Layer/subplate Excitatory Neuron PFC	Human fetal	Nowakowski et al 2017	2.51004016064257e-4	5.727133286268773e-4	-0.5587631915236251	-2.229171558242428	GRM5, RALYL, COL19A1, CSMD3, ZFPM2, CNTN1, SUSD4, IGSF21, KHDRBS3, OPCML, CSGALNACT1, PAPPA2, LRRTM4, GUCY1A2, LRP1B, SH3GL2, SYN3, UNC13C, GRIK2, CDH10, MLIP, ASTN2, HOOK1, KAZN, CARD10, KCNMA1, IQCA1, CDH18, OLFM3, DPP10, CAMKV, GABRG3, ELMOD1, C1orf95, CALN1, CNTNAP3, MTUS2, VSNL1, GRIN2B, GARNL3, HCRTR2, PDZD2, KLHL1, CLSTN2, ABLIM3, GABRA5, SLC5A8, COL25A1
HGG-G34R.V_vs_HGG-H3.3-K27M-thalamic	Str/SVZ 1-SPN	Mouse P9	Anderson et al 2020	2.4919013207077e-4	5.727133286268773e-4	-0.5655443367371437	-2.235866656501087	CNTNAP5, CNTNAP5, GRM5, KCND2, CSMD3, CNTN1, LY6H, EPHA6, POU6F2, KCTD16, LRRTM4, NLGN1, TENM2, FGF14, GALNT13, LRFN5, LRP1B, RELN, ATP2B2, ANO3, SYT1, GRIK2, ATP2B1, SGCZ, CADM2, GRID2, RBFOX1, CNTN3, PDE10A, DAB1, GABRG3, GABRB3, KCNQ5, ELMOD1, NETO1, CALN1, LRRC4C, STXBP5L, DLGAP2, GRIN2B, KCNAB1, NEBL, ADAM23, CNTNAP2, ATP1B1, EPHA7, PTPRD, GALNT8, KCNIP4, KCTD8, CDH8
HGG-G34R.V_vs_HGG-H3.3-K27M-thalamic	Maturing neurons	Human ped/adult	Velmeshev et al 2019	2.51004016064257e-4	5.727133286268773e-4	-0.5707879414595454	-2.2771439926453434	RALYL, GRIA4, CDH12, FAM19A2, EPHA6, RIMS2, CNTN4, KHDRBS2, KCTD16, LRRTM4, ARPP21, TENM2, LRFN5, ANO3, SYT1, CACNA1B, FAM19A1, PPFIA2, MLIP, ERC2, KCNMA1, CHRM3, ATP8A2, MIR137HG, NDST3, PVRL3, CDH18, KCNH1, ASIC2, RBFOX1, CBLN2, GABRB3, GALNTL6, KCNQ5, ERICH1-AS1, STXBP5L, DOK6, CAMK1D, RGS7, DLGAP2, DGKB, CHD5, CACNA1C, GRIN2B, FSTL4, RYR2, HOMER1, FRMPD4, CNTNAP2, AGBL4, PTPRD, KCNIP4
HGG-G34R.V_vs_HGG-H3.3-K27M-thalamic	VSVZ-2 Neuron	Mouse adult	Mizrak et al 2019	2.4962556165751375e-4	5.727133286268773e-4	-0.5815536639311392	-2.3042176225649946	GRM5, PEG3, CALY, VGF, SCN2A, LY6H, GNAL, HPCAL4, EEF1A2, GRIN1, RAB3C, ARPP21, RTN1, VSTM2L, NDRG4, AGAP2, PNMAL2, TMEM130, FBXL16, NRSN2, SYN1, PENK, ATP2B2, NSG2, SYT4, SYT1, CPLX1, SLC12A5, PPP3CA, PHYHIP, HPCA, NSF, RBFOX1, PRKCE, CAMKV, PRKAR1B, ELMOD1, STXBP1, SCN2B, ATP6V1G2, SULT4A1, VSNL1, PTPN5, RAB3A, GAP43, SNAP25, ARF3, CAMK2B, ATP1B1, CELF4, GPRASP1, NCDN, GRIA2, DNM1, CPLX2
HGG-G34R.V_vs_HGG-H3.3-K27M-thalamic	Str/SVZ 17-SPN	Mouse P9	Anderson et al 2020	2.46669955599408e-4	5.727133286268773e-4	-0.5864992637324308	-2.3165368895218417	CNTNAP5, SCN9A, GRM5, HECW1, LY6H, FAM19A2, NEGR1, CACNA2D2, LRRTM4, ARPP21, RIMS1, NNAT, TENM2, CACNA1E, STMN4, SYN3, PTPRN2, PENK, SYT1, PTPRM, ERC2, LSAMP, SGCZ, XKR4, NBEA, CHRM3, MAPK10, NDST3, PLCXD3, TLE4, ASIC2, RUNX1T1, RBFOX1, CNTN3, GABRG3, GABRB3, KCNQ5, ELMOD1, CALN1, ZNF804A, ZDBF2, BCL11B, CLMP, GRIN2B, CSRNP3, NEBL, ADAM23, CNTNAP2, PTPRD, CELF4, KCNIP4, USP29, CDH8, TMEM178B, TENM3
HGG-G34R.V_vs_HGG-H3.3-K27M-thalamic	Excitatory Neuron V1 - late born	Human fetal	Nowakowski et al 2017	2.51004016064257e-4	5.727133286268773e-4	-0.58283105687237	-2.3251896956518285	GABBR2, TRIM67, FRRS1L, NPY1R, NTRK2, CDH12, SCN2A, SYNGR3, FGF12, CNTN4, ARPP21, NCALD, TENM2, NEFM, FAM49A, KLHL32, SYN3, RHOU, FAM19A1, KCNH5, CHRM3, C1orf115, PIK3R1, SLITRK5, PRKCE, SYBU, KLHL4, CAMKV, UNC13A, ADAMTSL3, ELMOD1, CALN1, LRRC4C, C11orf87, CNTNAP3, PPP1R14C, DLGAP2, GRIN2B, RAP1GAP, GAP43, RYR2, KIAA1045, NEBL, FRMPD4, BCL6, CSMD2, NEO1, SHISA9, CAMK2B, RSPO3, MYO16, CXXC4, CDH8
HGG-G34R.V_vs_HGG-H3.3-K27M-thalamic	Cortical excitatory neurons	Mouse P3	Jessa et al 2019	2.4962556165751375e-4	5.727133286268773e-4	-0.5853366985324212	-2.3287087206249213	CALY, RALYL, HECW1, POU3F1, FAM19A2, SLC17A6, SHANK1, GPR85, ARPP21, PSD, TRPC4, LRFN5, GOLGA7B, STMN4, ARHGDIG, CD200, SYT4, SYT1, NDRG1, PPFIA2, CNIH2, MLIP, DMTN, ACTL6B, SYT5, FAM57B, SNCB, TUBB3, STMN2, EFNA3, RBFOX1, TUBB2B, CAMKV, PRKAR1B, L1CAM, CACNA2D1, MARCKSL1, CALN1, ELAVL3, SERP2, GNG3, CLMP, BEND6, RAB3A, GRIN2B, GAP43
HGG-G34R.V_vs_HGG-H3.3-K27M-thalamic	Str/SVZ 26-Ependymal	Mouse P9	Anderson et al 2020	2.452182442373713e-4	5.727133286268773e-4	-0.6120518995201361	-2.3301835186821562	DNAH2, SLC38A1, RGS22, DYNLRB2, ITM2C, SPAG17, ADAMTS20, RSPH1, TPPP3, ZBBX, WDR78, RIIAD1, LRRIQ1, ARMC3, TMEM212, DBI, DNAH3, SPATA17, TM4SF1, DNAH6, CCDC30, MEIG1, KIF6, NME5, PIFO, CCDC114, RARRES2, TTC29, AK7, SYNE1, WWC1, DNAH7, MAATS1, PACRG, AGBL4, PPIL6, EFCAB1
HGG-G34R.V_vs_HGG-H3.3-K27M-thalamic	Str/SVZ 28-SPN	Mouse P9	Anderson et al 2020	2.49003984063745e-4	5.727133286268773e-4	-0.587606290694977	-2.3352312522683185	CNTNAP5, CNTNAP5, GRM5, CSMD3, CDH12, LY6H, RIT2, FAM19A2, PRKAR2B, NEGR1, RIMS2, KHDRBS2, RIMS1, KCNB2, TENM2, LRFN5, LIN7A, CACNA1E, LRP1B, SYNDIG1, PTPRN2, SYT1, GRIK2, PCDH17, ERC2, FOXP2, KCNIP1, PLCXD3, CDH18, KCNH1, GRIK1, OLFM3, DPP10, GABRB3, KCNQ5, FRAS1, CALN1, CNTNAP3, ZNF804A, DLGAP2, ZDBF2, AK5, DGKB, GRIN2B, FSTL4, CA11, SNAP25, TRHR, CNTNAP2, COL25A1, PTPRD, KCNIP4, USP29
HGG-G34R.V_vs_HGG-H3.3-K27M-thalamic	Str/SVZ 13-SPN	Mouse P9	Anderson et al 2020	2.4648755237860487e-4	5.727133286268773e-4	-0.591482650054137	-2.350393832412422	CNTNAP5, GRM5, KCND2, LY6H, GNAL, ALCAM, EPHA6, CNTN4, KCTD16, DPP6, THRB, LRRTM4, TENM2, FGF14, SLC2A13, GALNT13, CACNA1E, LRP1B, PENK, ANO3, SYT1, GRIK2, ATP2B1, PDE4B, SGCZ, XKR4, CHRM3, GRID2, RBFOX1, PDE10A, GABRG3, GABRB3, KCNQ5, ELMOD1, NETO1, CALN1, LRRC4C, ZNF804A, DLGAP2, DGKB, GRIN2B, KCNAB1, NEBL, CA11, CNTNAP2, EPHA7, PTPRD, GALNT8, KCNIP4, KCTD8, CDH8, ADCY5
HGG-G34R.V_vs_HGG-H3.3-K27M-thalamic	Str/SVZ 24-SPN	Mouse P9	Anderson et al 2020	2.4962556165751375e-4	5.727133286268773e-4	-0.6087802776384983	-2.4120942416944975	CA10, LYPD1, DNM3, ADARB2, LY6H, NTNG1, FAM19A2, TSHZ1, OPCML, KCTD16, DPP6, FAM155A, TENM2, SLC2A13, SYT6, SYNDIG1, SYT1, ATP2B1, PTPRM, PBX3, PDE4B, ERC2, LSAMP, XKR4, FOXP2, KCNIP1, PLCXD3, RXRG, KCNT2, ASIC2, RUNX1T1, PCDH15, RBFOX1, OLFM3, GABRG3, KCNQ5, SLC44A5, GRIN2B, SEMA3A, RYR2, CLSTN2, CNTNAP2, COL25A1, WSCD2, AGBL4, GALNT8, KCNIP4
HGG-G34R.V_vs_HGG-H3.3-K27M-thalamic	Choroid	Human fetal	Nowakowski et al 2017	2.51004016064257e-4	5.727133286268773e-4	-0.6162981052290613	-2.458705634902644	TTR, DAW1, SPAG6, SPAG17, SOSTDC1, HTR2C, RSPH1, ATG9B, TPPP3, RIBC2, C11orf88, WDR16, C9orf24, WDR78, F5, C2orf40, ADGB, WDR65, AKAP14, LRRIQ1, SLC39A12, C4orf22, DRC1, WDR96, CCDC11, ARMC3, C5orf49, TCTEX1D1, FOLR1, STPG1, SLC16A10, C2orf73, TAF4B, FAM183A, DNAAF1, FAM47E, PCDP1, OTX2, MAP3K19, DCDC2, PIFO, MDH1B, PARM1, SLC13A4, AK7, SPATA18, DNAH7, DNAH7, C11orf70, MORN5, SLC2A12, EFCAB1, ROPN1L, TTC40, EPHX2, SULF1, SPA17, TEKT1
HGG-G34R.V_vs_HGG-H3.3-K27M-thalamic	VSVZ-1 Neuron	Mouse adult	Mizrak et al 2019	2.4271844660194174e-4	5.727133286268773e-4	-0.6399464520324688	-2.5187045726842734	GRM5, CALY, VAT1L, VGF, SCN2A, CELF5, GNAL, HPCAL4, CDK5R2, GRIN1, RAB3C, ARPP21, PPP1R1B, UNC80, CAMK4, PSD, NDRG4, AGAP2, TMEM130, RGS9, FBXL16, DDN, PENK, ATP2B2, SPTBN2, SYT1, CNIH2, SLC12A5, PPP3CA, SNCB, PHYHIP, HPCA, RBFOX1, PRKCE, PDE10A, CAMKV, CALN1, SCN2B, ATP6V1G2, SULT4A1, VSNL1, PTPN5, GRIN2B, GAP43, CAMK2A, SNAP25, ARF3, KCNQ2, CAMK2B, SH2D5, CELF4, ADCY5, NCDN, DNM1, CPLX2
HGG-G34R.V_vs_HGG-H3.3-K27M-thalamic	Str/SVZ 29-SPN	Mouse P9	Anderson et al 2020	2.5031289111389235e-4	5.727133286268773e-4	-0.6511419475307159	-2.594787443301753	EFNB3, SCN9A, GRM5, CALY, GRIA4, CSMD3, ZNF804B, CA10, LY6H, TRHDE, OPCML, DPP6, CACNA2D2, LRRTM4, RIMS1, NLGN1, FAM155A, TENM2, TMEFF2, DGKG, TRPC4, LRFN5, TMEM130, LIN28B, DNER, ZMAT4, SYT1, FAM19A1, PPFIA2, XKR4, SLC12A5, KCNMA1, CHRM3, SLC8A1, DSCAM, CDH18, KCNT2, GRID2, PCDH15, RBFOX1, GRIK1, KCNJ3, DPP10, MARCH1, GABRG3, PGAP1, ZIC4, VSNL1, GRIN2B, GARNL3, RYR2, RESP18, CNTNAP2, ATP1B1, AGBL4, GALNT8
HGG-G34R.V_vs_HGG-H3.3-K27M-thalamic	VSVZ-1 COP	Mouse adult	Mizrak et al 2019	2.4962556165751375e-4	5.727133286268773e-4	-0.6706796107902984	-2.6573502569507057	SEMA3D, LIMS2, RAB33A, GPR17, SOX10, NEU4, UST, SLC1A1, TRAF4, SUSD4, TNR, SUSD5, ZNF488, CHST8, OPCML, TCF7L2, MATN1, KIAA1644, SIRT2, BRINP1, GNG4, PRKCQ, RNF128, GAL3ST1, ENPP6, COL9A3, S100B, DCT, SULF2, KANK1, C8orf46, CHST3, MPZL1, TNFRSF21, C1orf106, C14orf37, DSCAM, DYNLL2, RAP2A, TNS3, NFASC, WASF1, TMEM163, PXDC1, GNB4, PYCR1, PLXNB3, PTPRE, SCRG1
HGG-G34R.V_vs_HGG-H3.3-K27M-thalamic	VSVZ-2 COP	Mouse adult	Mizrak et al 2019	2.4962556165751375e-4	5.727133286268773e-4	-0.674811963408073	-2.673723362848043	SEMA3D, OLIG2, LIMS2, RAB33A, GPR17, SOX10, NEU4, UST, UGT8, LUZP2, CNTN1, SLC1A1, TNR, OLIG1, ENPP2, KNDC1, TCF7L2, KIAA1644, PCDH7, SIRT2, TMEFF2, PLLP, PELI1, GAL3ST1, ENPP6, COL9A3, SULF2, KANK1, C8orf46, MPZL1, GNG12, DYNLL2, RAP2A, TNS3, NFASC, MBP, TMEM163, PXDC1, TSPAN2, GNB4, MARCKS, PLXNB3, CLDN11
HGG-G34R.V_vs_HGG-H3.3-K27M-thalamic	Newly-forming oligodendrocytes	Mouse P6	Jessa et al 2019	2.4962556165751375e-4	5.727133286268773e-4	-0.675726094994062	-2.677345312532859	LIMS2, RAB33A, GPR17, SOX10, NEU4, UST, UGT8, SPATA6L, DNM3, SLC1A1, TNR, ENPP2, ZNF488, OPCML, MATN4, SGK1, KIAA1644, SIRT2, TMEFF2, PLLP, AMZ1, PRKCQ, TMEM88B, GAL3ST1, ENPP6, COL9A3, S100B, KANK1, C8orf46, CDK14, NKX2-2, C14orf37, FBXO7, CBLN2, TNS3, NFASC, WASF1, SLC5A7, MBP, TMEM163, DUSP26, PXDC1, PLXNB3, CLDN11, PTPRE, PPP1R16B, SLC44A1, TUBB4A, AP2A1, GJC3, EPCAM, FA2H, S100A1, BCAS1, FYN, C16orf45, EPB41L2, CNP, GP1BB, MAG
HGG-G34R.V_vs_HGG-H3.3-K27M-thalamic	Oligodendrocyte precursor cells	Mouse P0	Jessa et al 2019	2.4962556165751375e-4	5.727133286268773e-4	-0.690830022768497	-2.7371897236445446	NXPH1, C1QL1, OLIG2, LHFPL3, RPRM, KCNIP3, SOX10, KCND2, BRINP3, XYLT1, CNTN1, TRAF4, PCDH11Y, OLIG1, UGDH, ARL4A, ENPP2, G0S2, CCND1, SAPCD2, PCDH11X, NCALD, PLLP, SERPINE2, EPN2, LRP1B, SULF2, C8orf46, RGCC, NAP1L5, TIMP4, PIK3R1, PCDH15, SMOC1, B3GAT2, TSPAN12, SOX8, DUSP26, QPCT, BCAN, PPP1R14C, SOX6, RAP1GAP, PTPRE, SCRG1, PPP1R16B, ARL2BP
HGG-G34R.V_vs_HGG-H3.3-K27M-thalamic	Newly-forming oligodendrocytes	Mouse P3	Jessa et al 2019	2.4648755237860487e-4	5.727133286268773e-4	-0.6948239017762149	-2.7610443234439344	LIMS2, RAB33A, GPR17, SOX10, NEU4, UST, UGT8, SPATA6L, DNM3, SLC1A1, NCAM2, TNR, ENPP2, ZNF488, OPCML, TCF7L2, MATN4, SGK1, KIAA1644, SIRT2, EHD3, PLLP, CDKN1C, AMZ1, PRKCQ, GAL3ST1, ENPP6, COL9A3, S100B, KANK1, C8orf46, NKX2-2, SPSB1, FBXO7, TNS3, NFASC, WASF1, SLC5A7, MBP, SOX8, TMEM163, DUSP26, PXDC1, PLXNB3, CLDN11, PTPRE, SCRG1, PPP1R16B
HGG-G34R.V_vs_HGG-H3.3-K27M-thalamic	VSVZ-2 OPC	Mouse adult	Mizrak et al 2019	2.4962556165751375e-4	5.727133286268773e-4	-0.6999129343278012	-2.7731778124095157	NXPH1, C1QL1, OLIG2, RPRM, KCNIP3, LIMS2, GPR17, SOX10, NEU4, XYLT1, LUZP2, CNTN1, TRAF4, TNR, OLIG1, UGDH, RAMP1, G0S2, CCND1, MATN4, NCALD, PLLP, SERPINE2, BRINP1, PHLDA1, ZDHHC2, EPN2, S100B, SULF2, KANK1, C8orf46, PTN, CSPG4, DBI, RGCC, NLGN3, ADCYAP1R1, TCEAL3, SNX22, QPCT, BCAN, PXDC1, GNG3, MARCKS, SCRG1, ZCCHC24, ARL2BP, FXYD6, BEX4, CASKIN2, CACNG4, LRRN1, MFSD2A, PCSK1N, GJC3, MIDN, STMN3, S100A1
HGG-G34R.V_vs_HGG-H3.3-K27M-thalamic	Str/SVZ 15-OPCs	Mouse P9	Anderson et al 2020	2.4919013207077e-4	5.727133286268773e-4	-0.7052316878333437	-2.7881174180468027	SEMA3D, LIMS2, GPR17, SOX10, NEU4, UST, BRINP3, UGT8, DNM3, SLC1A1, NCAM2, TNR, ENPP2, CDH20, OPCML, TCF7L2, CSGALNACT1, NCALD, PCDH7, IGSF9B, SIRT2, TMEFF2, ZDHHC14, PLLP, PRKCQ, GAL3ST1, SHISA4, ENPP6, COL9A3, S100B, SULF2, KANK1, CDK14, CDC37L1, PDE4B, MPZL1, KAZN, NKX2-2, TMEM132D, DSCAM, DYNLL2, CAMSAP2, TNS3, NFASC, MBP, SOX8, TMEM163, SOX6
HGG-G34R.V_vs_HGG-H3.3-K27M-thalamic	Str/SVZ 16-OPCs	Mouse P9	Anderson et al 2020	2.4962556165751375e-4	5.727133286268773e-4	-0.7213083660463663	-2.857950265694482	NXPH1, C1QL1, SEMA3D, MEGF11, OLIG2, KCNIP3, GPR17, SOX10, MYT1, KCND2, MMP16, BRINP3, XYLT1, LNX1, LUZP2, CNTN1, NCAM2, PPAPDC1A, TNR, OLIG1, ENPP2, CDH20, OPCML, FIGN, NCALD, PCDH7, FAM155A, ZDHHC2, EPN2, LRP1B, PRKCQ, DNER, SULF2, KANK1, FAM19A1, CSPG4, KIF13A, PDE4B, ASTN2, TMEM132D, RGCC, DSCAM, PCDH15, GRIK1, DPP10, B3GAT2, SOX5, CHST11, STK32A, SOX8, ANKS1B, PPP1R14C, SOX6
HGG-G34R.V_vs_HGG-H3.3-K27M-thalamic	Str/SVZ 4-OPCs	Mouse P9	Anderson et al 2020	2.4919013207077e-4	5.727133286268773e-4	-0.7512289679124003	-2.9699666173719206	NXPH1, C1QL1, SEMA3D, MEGF11, OLIG2, KCNIP3, GPR17, SOX10, MYT1, KCND2, MMP16, CSMD3, BRINP3, XYLT1, LNX1, LUZP2, CNTN1, PPAPDC1A, TNR, OLIG1, ENPP2, OPCML, CALCRL, NCALD, NLGN1, FAM155A, SERPINE2, PHLDA1, EPN2, LRP1B, PRKCQ, SULF2, KANK1, FAM19A1, CSPG4, KIF13A, PDE4B, ASTN2, LSAMP, TMEM132D, RGCC, DSCAM, PCDH15, GRIK1, DPP10, SOX5, NOVA1, CHST11, STK32A, LRRC4C, SOX8, ANKS1B, PPP1R14C, SOX6, IL1RAP, PTPRE, SCRG1, GPC5
HGG-G34R.V_vs_HGG-H3.3-K27M-thalamic	VSVZ-1 OPC	Mouse adult	Mizrak et al 2019	2.46669955599408e-4	5.727133286268773e-4	-0.7555463075123695	-2.984233743033148	FAM89A, NXPH1, C1QL1, MEGF11, OLIG2, RPRM, KCNIP3, GPR17, NEU4, CALY, BRINP3, XYLT1, LNX1, CNTN1, TRAF4, LY6H, TNR, OLIG1, RAMP1, SUSD5, G0S2, CCND1, SAPCD2, C1QL2, DPP6, MATN4, NCALD, FAM155A, PLLP, SERPINE2, BRINP1, PHLDA1, ZDHHC2, EPN2, VSTM2B, TMEM121, SULF2, KANK1, C8orf46, CSPG4, GSX1, C14orf37, OLFM2, RGCC, TMEM179, DSCAM, SLC7A3, PCDH15, B3GAT2, IGFBP3, DCAF12L2, TCEAL3, SNX22, QPCT, PPP1R14C, PXDC1, GNG3, TACC2, SCRG1
HGG-G34R.V_vs_HGG-H3.3-K27M-thalamic	Oligodendrocyte precursor cells	Human ped/adult	Velmeshev et al 2019	2.5031289111389235e-4	5.727133286268773e-4	-0.7651693450370993	-3.0491843077089325	NXPH1, MEGF11, LHFPL3, CNTNAP5, NOVA1-AS1, KCND2, MMP16, CSMD3, BRINP3, XYLT1, CA10, LUZP2, ZFPM2, ADARB2, TNR, OLIG1, NTNG1, USP24, FGF12, OPCML, DPP6, LPHN3, LRRTM4, AGAP1, COL9A1, NLGN1, FGF14, PTPRT, GALNT13, SCN1A, PLEKHH2, EPN2, LRP1B, SULF2, GRIK2, KIF13A, ASTN2, LSAMP, SGCZ, KAZN, KAT2B, RP11-385J1.2, SPATA6, DSCAM, GRID2, PCDH15, SMOC1, ZNF462, GRIK1, DAB1, APOD, NOVA1, CHST11, RORA, STK32A, LRRC4C, SCD5, BCAN, SOX6
HGG-G34R.V_vs_HGG-H3.3-K27M-thalamic	Oligodendrocyte precursor cells	Mouse P3	Jessa et al 2019	2.4919013207077e-4	5.727133286268773e-4	-0.7756442899781251	-3.0664920371638287	NXPH1, C1QL1, OLIG2, LHFPL3, RPRM, LIMS2, GPR17, SOX10, KCND2, MMP16, BRINP3, LNX1, SPATA6L, DNM3, CNTN1, SLC1A1, PCDH11Y, MDGA2, TNR, OLIG1, UGDH, ENPP2, CCND1, SAPCD2, KHDRBS2, OPCML, MATN4, PCDH11X, NCALD, TGFA, PLLP, SERPINE2, BRINP1, PHLDA1, ZDHHC2, EPN2, LRP1B, PRKCQ, SULF2, C8orf46, FAM19A1, CSPG4, LSAMP, NKX2-2, SPCS3, C14orf37, RGCC, NAP1L5, DSCAM, PIK3R1, PCDH15, NLGN3, B3GAT2, SOX8, QPCT, OMG, PPP1R14C, SOX6, FXYD6-FXYD2, TACC2, PTPRE, SCRG1, PPP1R16B, RESP18, ARL2BP, FXYD6
HGG-G34R.V_vs_HGG-H3.3-K27M-thalamic	Oligodendrocyte precursor cells	Mouse P6	Jessa et al 2019	2.4648755237860487e-4	5.727133286268773e-4	-0.780663872409173	-3.102149404939903	NXPH1, C1QL1, OLIG2, LHFPL3, RPRM, LIMS2, GPR17, SOX10, CALY, KCND2, MMP16, CSMD3, BRINP3, LNX1, LYPD1, CNTN1, LY6H, PCDH11Y, TNR, OLIG1, UGDH, DCAF12L1, SAPCD2, KHDRBS2, OPCML, MATN4, PCDH11X, NCALD, PLLP, BRINP1, ZDHHC2, GALNT13, SYT16, SCN3A, EPN2, LRP1B, PRKCQ, STMN4, TCEAL5, SULF2, C8orf46, FAM19A1, CSPG4, LSAMP, BEX2, SPCS3, C14orf37, NAP1L5, DSCAM, TCEAL6, PCDH15, B3GAT2, DCAF12L2, TCEAL3, SOX8, QPCT, OMG, PPP1R14C, SOX6, GNG3, FXYD6-FXYD2, TACC2, GAP43, PTPRE, SCRG1, RESP18, ARL2BP, SNAP25, FXYD6
HGG-G34R.V_vs_HGG-H3.3-K27M-thalamic	Oligodendrocyte progenitor cell	Human fetal	Nowakowski et al 2017	2.51004016064257e-4	5.727133286268773e-4	-0.7906475833462212	-3.154268448826386	NXPH1, OLIG2, LIMS2, GPR17, KCND2, MMP16, BRINP3, UGT8, XYLT1, CA10, LUZP2, ERBB3, LRRK2, CNTN1, NCAM2, ANKRD20A1, BMP8B, BMP8B, TNR, OLIG1, ARL4A, NTNG1, B3GNT7, CALCRL, CSGALNACT1, DOCK10, COL9A1, SIRT2, SERPINE2, GALNT13, SCN1A, PLEKHH2, FIBIN, AFAP1L2, VSTM2B, HAS2, S100B, SULF2, KANK1, C8orf46, PDE4B, CHST3, SLITRK2, SPATA6, CHRM3, CADM2, P2RX7, DSCAM, GNG12, PCDH15, SMOC1, NLGN3, TNS3, C2orf80, APOD, RAPGEF4, APCDD1, NETO1, SNX22, MBP, LRRC4C, RAB31, BCAN, OMG, IL1RAP, PLOD2, CLDN11, PMP2, NTN1, ZCCHC24
HGG-G34R.V_vs_PNET-HGNET-BCOR	Microglia	Human fetal	Nowakowski et al 2017	6.939625260235947e-4	0.0015563722657544166	0.7870146415144822	3.8755814007972056	TREM2, C1QA, STAB1, ITGB2, ITGB2, C1QC, C1QB, C3AR1, ITGAX, CSF1R, VSIG4, HMOX1, LAPTM5, CD53, TYROBP, CD84, HAVCR2, CYTH4, CYBB, IL6R, CD4, C3, RHBDF2, ADAP2, CSF1, CH25H, ADORA3, RNASE1, INPP5D, FPR1, SELPLG, LY86, APBB1IP, MSR1, LAT2, NCKAP1L, OLR1, TLR7, SPP1, HCLS1, CD74, FGD2, ATP8B4, FOLR2, PTGS1, SIGLEC8, NLRP3, TLR4, BCL2A1, BCL2A1, BCL2A1, BCL2A1, LCP1, CSF2RA, PLEK, SAMSN1, MS4A7, C10orf54, IRF8, DOCK8, PTPRC, NCF4, PTAFR, PTGER4, FCGR2A, FCGR2A, FCER1G, ARHGAP25, RGS10, ITGAM, CCL3, CSF3R, CX3CR1, C5AR1, LCP2, SRGN, RGS1, FCGR1A, IL1B, BIN2, ADAM28
HGG-G34R.V_vs_PNET-HGNET-BCOR	Microglia	Mouse P0	Jessa et al 2019	7.08215297450425e-4	0.0015563722657544166	0.7460963067609491	3.6840584879879468	FERMT3, TREM2, C1QA, ITGB2, C1QC, TMEM119, NRROS, C1QB, C3AR1, SLC15A3, LTC4S, LRRC25, PTPN6, PSMB8, ABI3, LAIR1, CSF1R, LAPTM5, CD53, TYROBP, CD84, HCK, CYTH4, ARHGAP30, UNC93B1, CTSS, ADORA3, ADORA3, CD68, RAC2, LYZ, SPI1, AIF1, SELPLG, LY86, APBB1IP, PTPN18, MS4A6A, MS4A6A, FGD2, MYO1F, PLD4, OLFML3, GPR34, SLC11A1, CD37, GMFG, NCF2, EVI2A, PTGS1, ALOX5AP, TBXAS1, IRF5, CD300A, CD180, BCL2A1, LCP1, SUSD3, LST1, IKZF1, IRF8, PTPRC, CD300C, TNFAIP8L2, FCGR2A, EHD4, CD48, FCGR1B, FCER1G, RGS10, LPCAT2, ITGAM, ITGAM, LYN, CCL3
